tunecache.tsv
tunecache	0.7.2	0.7.2	cpu_arch=x86_64,gpu_arch=sm_35,cuda_version=7000	# Last updated Fri Jan 29 22:21:00 2016

volume	name	aux	block.x	block.y	block.z	grid.x	grid.y	grid.z	shared_bytes	comment
16x16x16x8	N4quda11CopyGaugeExIddLi18ENS_11FloatNOrderIdLi18ELi2ELi8EEES2_EE	out_stride=16384,in_stride=18432,geometery=4	128	1	1	128	1	1	0	# 0.00 Gflop/s, 129.04 GB/s, tuned Wed Dec 16 16:39:40 2015
16x16x16x8	N4quda11CopyGaugeExIddLi18ENS_11FloatNOrderIdLi18ELi2ELi8EEES2_EE	out_stride=16384,in_stride=48000,geometery=4	96	1	1	171	1	1	0	# 0.00 Gflop/s, 117.24 GB/s, tuned Wed Dec 16 16:39:41 2015
16x16x16x8	N4quda8GaugeAPEIdNS_11FloatNOrderIdLi18ELi2ELi8EEES2_EE	threads=32768,prec=8	256	1	1	128	1	1	0	# 0.01 Gflop/s, 0.10 GB/s, tuned Wed Dec 16 16:39:41 2015
16x16x16x8	N4quda9GaugePlaqIdNS_11FloatNOrderIdLi18ELi2ELi8EEEEE	threads=16384,prec=8	64	2	1	256	1	1	6145	# 81.24 Gflop/s, 34.83 GB/s, tuned Wed Dec 16 16:39:40 2015
20x20x20x12	N4quda11CopyGaugeExIddLi18ENS_11FloatNOrderIdLi18ELi2ELi8EEES2_EE	out_stride=48000,in_stride=16384,geometery=4	320	1	1	52	1	1	16385	# 0.00 Gflop/s, 93.79 GB/s, tuned Wed Dec 16 16:39:41 2015
20x20x20x12	N4quda11CopyGaugeExIddLi18ENS_11FloatNOrderIdLi18ELi2ELi8EEES2_EE	out_stride=48000,in_stride=18432,geometery=4	320	1	1	52	1	1	16385	# 0.00 Gflop/s, 92.08 GB/s, tuned Wed Dec 16 16:39:40 2015
20x20x20x12	N4quda11CopyGaugeExIddLi18ENS_11FloatNOrderIdLi18ELi2ELi8EEES2_EE	out_stride=48000,in_stride=48000,geometery=4	288	1	1	167	1	1	0	# 0.00 Gflop/s, 158.53 GB/s, tuned Wed Dec 16 16:39:41 2015
20x20x20x12	N4quda14ExtractGhostExIdLi18ELi4ELi0ENS_11FloatNOrderIdLi18ELi2ELi8EEEEE	prec=8,stride=48000,extract=0,dimension=0	288	1	1	57	1	1	7022	# 0.00 Gflop/s, 56.50 GB/s, tuned Wed Dec 16 16:39:40 2015
20x20x20x12	N4quda14ExtractGhostExIdLi18ELi4ELi0ENS_11FloatNOrderIdLi18ELi2ELi8EEEEE	prec=8,stride=48000,extract=1,dimension=0	384	1	1	43	1	1	16385	# 0.00 Gflop/s, 80.68 GB/s, tuned Wed Dec 16 16:39:40 2015
20x20x20x12	N4quda14ExtractGhostExIdLi18ELi4ELi1ENS_11FloatNOrderIdLi18ELi2ELi8EEEEE	prec=8,stride=48000,extract=0,dimension=1	128	1	1	160	1	1	0	# 0.00 Gflop/s, 161.98 GB/s, tuned Wed Dec 16 16:39:40 2015
20x20x20x12	N4quda14ExtractGhostExIdLi18ELi4ELi1ENS_11FloatNOrderIdLi18ELi2ELi8EEEEE	prec=8,stride=48000,extract=1,dimension=1	128	1	1	160	1	1	0	# 0.00 Gflop/s, 149.15 GB/s, tuned Wed Dec 16 16:39:40 2015
20x20x20x12	N4quda14ExtractGhostExIdLi18ELi4ELi2ENS_11FloatNOrderIdLi18ELi2ELi8EEEEE	prec=8,stride=48000,extract=0,dimension=2	128	1	1	200	1	1	0	# 0.00 Gflop/s, 172.97 GB/s, tuned Wed Dec 16 16:39:40 2015
20x20x20x12	N4quda14ExtractGhostExIdLi18ELi4ELi2ENS_11FloatNOrderIdLi18ELi2ELi8EEEEE	prec=8,stride=48000,extract=1,dimension=2	96	1	1	267	1	1	0	# 0.00 Gflop/s, 158.27 GB/s, tuned Wed Dec 16 16:39:40 2015
20x20x20x12	N4quda14ExtractGhostExIdLi18ELi4ELi3ENS_11FloatNOrderIdLi18ELi2ELi8EEEEE	prec=8,stride=48000,extract=0,dimension=3	128	1	1	500	1	1	0	# 0.00 Gflop/s, 195.64 GB/s, tuned Wed Dec 16 16:39:40 2015
20x20x20x12	N4quda14ExtractGhostExIdLi18ELi4ELi3ENS_11FloatNOrderIdLi18ELi2ELi8EEEEE	prec=8,stride=48000,extract=1,dimension=3	128	1	1	500	1	1	0	# 0.00 Gflop/s, 176.67 GB/s, tuned Wed Dec 16 16:39:40 2015
24x48x24x4	N4quda11axpyCGNorm2I7double26float26float4EE	vol=110592,stride=110592,precision=4,TwistFlavour=-1	1024	1	1	27	1	1	16384	# 75.34 Gflop/s, 150.69 GB/s, tuned Mon Dec 28 19:41:20 2015
24x48x24x4	N4quda11axpyCGNorm2I7double26float26float4EE	vol=110592,stride=110592,precision=4,TwistFlavour=1	1024	1	1	28	1	1	16384	# 75.38 Gflop/s, 150.76 GB/s, tuned Mon Dec 28 19:40:52 2015
24x48x24x4	N4quda14PackFaceWilsonI6float4fEE	vol=110592,stride=110592,precision=4,TwistFlavour=-1,comm=0011,nFace=1	416	1	1	23	1	1	7022	# 10.80 Gflop/s, 129.60 GB/s, tuned Mon Dec 28 19:41:17 2015
24x48x24x4	N4quda14PackFaceWilsonI6float4fEE	vol=110592,stride=110592,precision=4,TwistFlavour=1,comm=0011,nFace=1	64	1	1	144	1	1	0	# 10.97 Gflop/s, 131.66 GB/s, tuned Mon Dec 28 19:40:48 2015
24x48x24x4	N4quda14PackFaceWilsonI7double2dEE	vol=110592,stride=110592,precision=8,TwistFlavour=-1,comm=0011,nFace=1	64	1	1	144	1	1	0	# 4.86 Gflop/s, 116.55 GB/s, tuned Mon Dec 28 19:41:14 2015
24x48x24x4	N4quda14PackFaceWilsonI7double2dEE	vol=110592,stride=110592,precision=8,TwistFlavour=1,comm=0011,nFace=1	64	1	1	144	1	1	0	# 4.81 Gflop/s, 115.41 GB/s, tuned Mon Dec 28 19:40:38 2015
24x48x24x4	N4quda16WilsonDslashCudaI7double2S1_EE	type=exterior_t,comm=0011,reconstruct=8,Xpay	192	1	1	576	1	1	7022	# 43.51 Gflop/s, 116.04 GB/s, tuned Mon Dec 28 19:40:39 2015
24x48x24x4	N4quda16WilsonDslashCudaI7double2S1_EE	type=exterior_z,comm=0011,reconstruct=8,Xpay	128	1	1	864	1	1	0	# 32.97 Gflop/s, 87.92 GB/s, tuned Mon Dec 28 19:40:39 2015
24x48x24x4	N4quda16WilsonDslashCudaI7double2S1_EE	type=interior,comm=0011,ghost=0011,reconstruct=8,Xpay	64	1	1	1728	1	1	0	# 136.07 Gflop/s, 188.54 GB/s, tuned Mon Dec 28 19:40:39 2015
24x48x24x4	N4quda21TwistCloverGamma5CudaI7double2S1_EE	vol=110592,stride=110592,precision=8,TwistFlavour=-1,inverse	384	1	1	288	1	1	16385	# 2.63 Gflop/s, 54.31 GB/s, tuned Mon Dec 28 19:41:40 2015
24x48x24x4	N4quda21TwistCloverGamma5CudaI7double2S1_EE	vol=110592,stride=110592,precision=8,TwistFlavour=1,inverse	384	1	1	288	1	1	8193	# 2.66 Gflop/s, 55.01 GB/s, tuned Mon Dec 28 19:40:38 2015
24x48x24x4	N4quda22HeavyQuarkResidualNormI7double37double2S2_EE	vol=110592,stride=110592,precision=8,TwistFlavour=-1	704	1	1	27	1	1	16896	# 39.75 Gflop/s, 158.99 GB/s, tuned Mon Dec 28 19:41:25 2015
24x48x24x4	N4quda22HeavyQuarkResidualNormI7double37double2S2_EE	vol=110592,stride=110592,precision=8,TwistFlavour=1	320	1	1	28	1	1	7680	# 39.77 Gflop/s, 159.07 GB/s, tuned Mon Dec 28 19:40:48 2015
24x48x24x4	N4quda23TwistedCloverDslashCudaI6float4S1_S1_EE	type=exterior_t,Dslash,comm=0011,reconstruct=8	160	1	1	692	1	1	0	# 31.69 Gflop/s, 35.75 GB/s, tuned Mon Dec 28 19:40:49 2015
24x48x24x4	N4quda23TwistedCloverDslashCudaI6float4S1_S1_EE	type=exterior_t,Dslash,comm=0011,reconstruct=8,dagger	320	1	1	346	1	1	16385	# 31.31 Gflop/s, 35.32 GB/s, tuned Mon Dec 28 19:40:49 2015
24x48x24x4	N4quda23TwistedCloverDslashCudaI6float4S1_S1_EE	type=exterior_t,DslashCloverTwist,comm=0011,reconstruct=8,Xpay	320	1	1	346	1	1	7022	# 52.59 Gflop/s, 70.12 GB/s, tuned Mon Dec 28 19:40:49 2015
24x48x24x4	N4quda23TwistedCloverDslashCudaI6float4S1_S1_EE	type=exterior_t,DslashCloverTwist,comm=0011,reconstruct=8,Xpay,dagger	128	1	1	864	1	1	0	# 52.39 Gflop/s, 69.86 GB/s, tuned Mon Dec 28 19:40:49 2015
24x48x24x4	N4quda23TwistedCloverDslashCudaI6float4S1_S1_EE	type=exterior_z,Dslash,comm=0011,reconstruct=8	192	1	1	576	1	1	6145	# 21.46 Gflop/s, 24.21 GB/s, tuned Mon Dec 28 19:40:49 2015
24x48x24x4	N4quda23TwistedCloverDslashCudaI6float4S1_S1_EE	type=exterior_z,Dslash,comm=0011,reconstruct=8,dagger	480	1	1	231	1	1	6145	# 21.10 Gflop/s, 23.81 GB/s, tuned Mon Dec 28 19:40:49 2015
24x48x24x4	N4quda23TwistedCloverDslashCudaI6float4S1_S1_EE	type=exterior_z,DslashCloverTwist,comm=0011,reconstruct=8,Xpay	192	1	1	576	1	1	6145	# 35.27 Gflop/s, 47.02 GB/s, tuned Mon Dec 28 19:40:49 2015
24x48x24x4	N4quda23TwistedCloverDslashCudaI6float4S1_S1_EE	type=exterior_z,DslashCloverTwist,comm=0011,reconstruct=8,Xpay,dagger	224	1	1	494	1	1	7022	# 35.05 Gflop/s, 46.74 GB/s, tuned Mon Dec 28 19:40:49 2015
24x48x24x4	N4quda23TwistedCloverDslashCudaI6float4S1_S1_EE	type=interior,Dslash,comm=0011,ghost=0011,reconstruct=8	128	1	1	864	1	1	0	# 330.76 Gflop/s, 224.59 GB/s, tuned Mon Dec 28 19:40:49 2015
24x48x24x4	N4quda23TwistedCloverDslashCudaI6float4S1_S1_EE	type=interior,Dslash,comm=0011,ghost=0011,reconstruct=8,dagger	128	1	1	864	1	1	0	# 327.84 Gflop/s, 222.61 GB/s, tuned Mon Dec 28 19:40:49 2015
24x48x24x4	N4quda23TwistedCloverDslashCudaI6float4S1_S1_EE	type=interior,DslashCloverTwist,comm=0011,ghost=0011,reconstruct=8,Xpay	160	1	1	692	1	1	0	# 370.62 Gflop/s, 237.34 GB/s, tuned Mon Dec 28 19:40:49 2015
24x48x24x4	N4quda23TwistedCloverDslashCudaI6float4S1_S1_EE	type=interior,DslashCloverTwist,comm=0011,ghost=0011,reconstruct=8,Xpay,dagger	320	1	1	346	1	1	6145	# 371.84 Gflop/s, 238.12 GB/s, tuned Mon Dec 28 19:40:49 2015
24x48x24x4	N4quda23TwistedCloverDslashCudaI7double2S1_S1_EE	type=exterior_t,Dslash,comm=0011,reconstruct=8	64	1	1	1728	1	1	0	# 15.44 Gflop/s, 34.83 GB/s, tuned Mon Dec 28 19:40:44 2015
24x48x24x4	N4quda23TwistedCloverDslashCudaI7double2S1_S1_EE	type=exterior_t,Dslash,comm=0011,reconstruct=8,dagger	128	1	1	864	1	1	16385	# 15.34 Gflop/s, 34.61 GB/s, tuned Mon Dec 28 19:40:39 2015
24x48x24x4	N4quda23TwistedCloverDslashCudaI7double2S1_S1_EE	type=exterior_t,DslashCloverTwist,comm=0011,reconstruct=8,Xpay	128	1	1	864	1	1	0	# 24.62 Gflop/s, 65.64 GB/s, tuned Mon Dec 28 19:40:44 2015
24x48x24x4	N4quda23TwistedCloverDslashCudaI7double2S1_S1_EE	type=exterior_t,DslashCloverTwist,comm=0011,reconstruct=8,Xpay,dagger	128	1	1	864	1	1	6145	# 24.68 Gflop/s, 65.80 GB/s, tuned Mon Dec 28 19:40:39 2015
24x48x24x4	N4quda23TwistedCloverDslashCudaI7double2S1_S1_EE	type=exterior_z,Dslash,comm=0011,reconstruct=8	128	1	1	864	1	1	7022	# 11.59 Gflop/s, 26.15 GB/s, tuned Mon Dec 28 19:40:44 2015
24x48x24x4	N4quda23TwistedCloverDslashCudaI7double2S1_S1_EE	type=exterior_z,Dslash,comm=0011,reconstruct=8,dagger	128	1	1	864	1	1	6145	# 11.61 Gflop/s, 26.19 GB/s, tuned Mon Dec 28 19:40:39 2015
24x48x24x4	N4quda23TwistedCloverDslashCudaI7double2S1_S1_EE	type=exterior_z,DslashCloverTwist,comm=0011,reconstruct=8,Xpay	128	1	1	864	1	1	16385	# 18.93 Gflop/s, 50.47 GB/s, tuned Mon Dec 28 19:40:44 2015
24x48x24x4	N4quda23TwistedCloverDslashCudaI7double2S1_S1_EE	type=exterior_z,DslashCloverTwist,comm=0011,reconstruct=8,Xpay,dagger	256	1	1	432	1	1	24577	# 18.43 Gflop/s, 49.14 GB/s, tuned Mon Dec 28 19:40:39 2015
24x48x24x4	N4quda23TwistedCloverDslashCudaI7double2S1_S1_EE	type=interior,Dslash,comm=0011,ghost=0011,reconstruct=8	64	1	1	1728	1	1	0	# 93.70 Gflop/s, 127.25 GB/s, tuned Mon Dec 28 19:40:44 2015
24x48x24x4	N4quda23TwistedCloverDslashCudaI7double2S1_S1_EE	type=interior,Dslash,comm=0011,ghost=0011,reconstruct=8,dagger	64	1	1	1728	1	1	0	# 117.52 Gflop/s, 159.59 GB/s, tuned Mon Dec 28 19:40:39 2015
24x48x24x4	N4quda23TwistedCloverDslashCudaI7double2S1_S1_EE	type=interior,DslashCloverTwist,comm=0011,ghost=0011,reconstruct=8,Xpay	32	1	1	3456	1	1	0	# 105.47 Gflop/s, 135.09 GB/s, tuned Mon Dec 28 19:40:44 2015
24x48x24x4	N4quda23TwistedCloverDslashCudaI7double2S1_S1_EE	type=interior,DslashCloverTwist,comm=0011,ghost=0011,reconstruct=8,Xpay,dagger	32	1	1	3456	1	1	0	# 104.48 Gflop/s, 133.82 GB/s, tuned Mon Dec 28 19:40:39 2015
24x48x24x4	N4quda25xpyHeavyQuarkResidualNormI7double37double2S2_EE	vol=110592,stride=110592,precision=8,TwistFlavour=1	320	1	1	27	1	1	7680	# 34.52 Gflop/s, 165.69 GB/s, tuned Mon Dec 28 19:40:55 2015
24x48x24x4	N4quda3DotId6float26float4EE	vol=110592,stride=110592,precision=4,TwistFlavour=-1	928	1	1	28	1	1	7424	# 37.60 Gflop/s, 150.42 GB/s, tuned Mon Dec 28 19:41:18 2015
24x48x24x4	N4quda3DotId6float26float4EE	vol=110592,stride=110592,precision=4,TwistFlavour=1	896	1	1	28	1	1	7168	# 37.66 Gflop/s, 150.62 GB/s, tuned Mon Dec 28 19:40:50 2015
24x48x24x4	N4quda3xpyI7double2S1_EE	vol=110592,stride=110592,precision=8,TwistFlavour=-1	832	1	1	28	1	1	0	# 7.33 Gflop/s, 175.91 GB/s, tuned Mon Dec 28 19:41:40 2015
24x48x24x4	N4quda3xpyI7double2S1_EE	vol=110592,stride=110592,precision=8,TwistFlavour=1	768	1	1	28	1	1	0	# 7.32 Gflop/s, 175.70 GB/s, tuned Mon Dec 28 19:40:59 2015
24x48x24x4	N4quda4axpyI6float26float4EE	vol=110592,stride=110592,precision=4,TwistFlavour=-1	768	1	1	28	1	1	0	# 28.88 Gflop/s, 173.26 GB/s, tuned Mon Dec 28 19:41:26 2015
24x48x24x4	N4quda4axpyI6float26float4EE	vol=110592,stride=110592,precision=4,TwistFlavour=1	800	1	1	28	1	1	0	# 28.87 Gflop/s, 173.19 GB/s, tuned Mon Dec 28 19:41:00 2015
24x48x24x4	N4quda4axpyI7double2S1_EE	vol=110592,stride=110592,precision=4,TwistFlavour=-1,vol=110592,stride=110592,precision=8,TwistFlavour=1	768	1	1	26	1	1	0	# 17.16 Gflop/s, 102.98 GB/s, tuned Mon Dec 28 19:41:23 2015
24x48x24x4	N4quda4axpyI7double2S1_EE	vol=110592,stride=110592,precision=4,TwistFlavour=1,vol=110592,stride=110592,precision=8,TwistFlavour=1	1024	1	1	11	1	1	0	# 17.15 Gflop/s, 102.88 GB/s, tuned Mon Dec 28 19:40:57 2015
24x48x24x4	N4quda4xpayI6float26float4EE	vol=110592,stride=110592,precision=4,TwistFlavour=-1	768	1	1	28	1	1	0	# 28.89 Gflop/s, 173.35 GB/s, tuned Mon Dec 28 19:41:27 2015
24x48x24x4	N4quda4xpayI6float26float4EE	vol=110592,stride=110592,precision=4,TwistFlavour=1	800	1	1	28	1	1	0	# 28.94 Gflop/s, 173.66 GB/s, tuned Mon Dec 28 19:41:01 2015
24x48x24x4	N4quda5Norm2Id7double2S1_EE	vol=110592,stride=110592,precision=8,TwistFlavour=1	960	1	1	28	1	1	7680	# 36.98 Gflop/s, 147.94 GB/s, tuned Mon Dec 28 19:40:44 2015
24x48x24x4	N4quda8axpyZpbxI7double2S1_EE	vol=110592,stride=110592,precision=4,TwistFlavour=-1,vol=110592,stride=110592,precision=8,TwistFlavour=1	128	1	1	28	1	1	0	# 47.22 Gflop/s, 118.05 GB/s, tuned Mon Dec 28 19:41:21 2015
24x48x24x4	N4quda8axpyZpbxI7double2S1_EE	vol=110592,stride=110592,precision=4,TwistFlavour=1,vol=110592,stride=110592,precision=8,TwistFlavour=1	256	1	1	12	1	1	0	# 46.95 Gflop/s, 117.37 GB/s, tuned Mon Dec 28 19:40:53 2015
24x48x24x4	N4quda8xmyNorm2Id7double2S1_EE	vol=110592,stride=110592,precision=8,TwistFlavour=1	768	1	1	28	1	1	6144	# 20.84 Gflop/s, 166.72 GB/s, tuned Mon Dec 28 19:40:46 2015
24x48x24x4	copyKernel	dst=vol=110592,stride=110592,precision=4,TwistFlavour=-1,src=vol=110592,stride=110592,precision=8,TwistFlavour=-1	896	1	1	25	1	1	0	# 0.00 Gflop/s, 169.76 GB/s, tuned Mon Dec 28 19:41:17 2015
24x48x24x4	copyKernel	dst=vol=110592,stride=110592,precision=4,TwistFlavour=1,src=vol=110592,stride=110592,precision=8,TwistFlavour=1	1024	1	1	12	1	1	0	# 0.00 Gflop/s, 170.77 GB/s, tuned Mon Dec 28 19:40:47 2015
24x48x24x4	copyKernel	dst=vol=110592,stride=110592,precision=8,TwistFlavour=-1,src=vol=110592,stride=110592,precision=4,TwistFlavour=-1	1024	1	1	27	1	1	0	# 0.00 Gflop/s, 163.17 GB/s, tuned Mon Dec 28 19:41:21 2015
24x48x24x4	copyKernel	dst=vol=110592,stride=110592,precision=8,TwistFlavour=1,src=vol=110592,stride=110592,precision=4,TwistFlavour=1	1024	1	1	28	1	1	0	# 0.00 Gflop/s, 163.27 GB/s, tuned Mon Dec 28 19:40:53 2015
24x48x48x2	N4quda10CovDevCudaId7double2EE	type=exterior_t,comm=0000,reconstruct=8	404	1	1	137	1	1	24577	# 2.43 Gflop/s, 5.94 GB/s, tuned Fri Jan 29 19:23:58 2016
24x48x48x2	N4quda10CovDevCudaId7double2EE	type=exterior_t,comm=0000,reconstruct=8,dagger	200	1	1	277	1	1	6145	# 2.41 Gflop/s, 5.90 GB/s, tuned Fri Jan 29 19:24:12 2016
24x48x48x2	N4quda10CovDevCudaId7double2EE	type=interior,comm=0000,ghost=0000,reconstruct=8	192	1	1	576	1	1	6145	# 53.48 Gflop/s, 760.65 GB/s, tuned Fri Jan 29 19:23:44 2016
24x48x48x2	N4quda10CovDevCudaId7double2EE	type=interior,comm=0000,ghost=0000,reconstruct=8,dagger	208	1	1	532	1	1	0	# 52.63 Gflop/s, 748.51 GB/s, tuned Fri Jan 29 19:23:45 2016
24x48x48x2	N4quda10Gamma5CudaI7double2EE	type=default	352	1	1	315	1	1	9831	# 5.20 Gflop/s, 249.46 GB/s, tuned Fri Jan 29 19:23:43 2016
24x48x48x2	N4quda11axpyCGNorm2I7double26float26float4EE	vol=110592,stride=110592,precision=4,TwistFlavour=-1	448	1	1	28	1	1	7168	# 75.15 Gflop/s, 150.31 GB/s, tuned Fri Jan 29 19:23:17 2016
24x48x48x2	N4quda12ContractCudaI7double2S1_EE	type=gamma5	96	1	1	1152	1	1	24576	# 13.48 Gflop/s, 64.70 GB/s, tuned Fri Jan 29 19:23:43 2016
24x48x48x2	N4quda12ContractCudaI7double2S1_EE	type=gamma5-minus	96	1	1	1152	1	1	24576	# 7.86 Gflop/s, 37.72 GB/s, tuned Fri Jan 29 19:23:45 2016
24x48x48x2	N4quda12ContractCudaI7double2S1_EE	type=gamma5-plus	96	1	1	1152	1	1	24576	# 7.87 Gflop/s, 37.77 GB/s, tuned Fri Jan 29 19:23:45 2016
24x48x48x2	N4quda16WilsonDslashCudaI7double2S1_EE	type=exterior_t,comm=0001,reconstruct=8,Xpay	96	1	1	1152	1	1	0	# 44.70 Gflop/s, 119.21 GB/s, tuned Fri Jan 29 19:23:04 2016
24x48x48x2	N4quda16WilsonDslashCudaI7double2S1_EE	type=interior,comm=0001,ghost=0001,reconstruct=8,Xpay	128	1	1	864	1	1	0	# 139.88 Gflop/s, 180.74 GB/s, tuned Fri Jan 29 19:23:04 2016
24x48x48x2	N4quda20AsymCloverDslashCudaI7double2S1_S1_EE	type=exterior_t,comm=0001,reconstruct=8,Xpay	128	1	1	864	1	1	0	# 58.21 Gflop/s, 155.24 GB/s, tuned Fri Jan 29 19:23:43 2016
24x48x48x2	N4quda20AsymCloverDslashCudaI7double2S1_S1_EE	type=interior,comm=0001,ghost=0001,reconstruct=8,Xpay	128	1	1	864	1	1	0	# 88.29 Gflop/s, 110.10 GB/s, tuned Fri Jan 29 19:23:43 2016
24x48x48x2	N4quda21TwistCloverGamma5CudaI7double2S1_EE	vol=110592,stride=110592,precision=8,TwistFlavour=-1,inverse	384	1	1	288	1	1	7022	# 2.65 Gflop/s, 63.65 GB/s, tuned Fri Jan 29 19:23:04 2016
24x48x48x2	N4quda22HeavyQuarkResidualNormI7double37double2S2_EE	vol=110592,stride=110592,precision=8,TwistFlavour=-1	320	1	1	27	1	1	7680	# 39.73 Gflop/s, 158.93 GB/s, tuned Fri Jan 29 19:23:14 2016
24x48x48x2	N4quda23TwistedCloverDslashCudaI6float4S1_S1_EE	type=exterior_t,Dslash,comm=0001,reconstruct=8	320	1	1	346	1	1	6145	# 30.35 Gflop/s, 34.24 GB/s, tuned Fri Jan 29 19:23:14 2016
24x48x48x2	N4quda23TwistedCloverDslashCudaI6float4S1_S1_EE	type=exterior_t,Dslash,comm=0001,reconstruct=8,dagger	640	1	1	173	1	1	16385	# 30.29 Gflop/s, 34.17 GB/s, tuned Fri Jan 29 19:23:14 2016
24x48x48x2	N4quda23TwistedCloverDslashCudaI6float4S1_S1_EE	type=exterior_t,DslashCloverTwist,comm=0001,reconstruct=8,Xpay	608	1	1	182	1	1	8193	# 51.42 Gflop/s, 68.56 GB/s, tuned Fri Jan 29 19:23:14 2016
24x48x48x2	N4quda23TwistedCloverDslashCudaI6float4S1_S1_EE	type=exterior_t,DslashCloverTwist,comm=0001,reconstruct=8,Xpay,dagger	608	1	1	182	1	1	6145	# 51.46 Gflop/s, 68.62 GB/s, tuned Fri Jan 29 19:23:15 2016
24x48x48x2	N4quda23TwistedCloverDslashCudaI6float4S1_S1_EE	type=interior,Dslash,comm=0001,ghost=0001,reconstruct=8	160	1	1	692	1	1	0	# 464.99 Gflop/s, 307.83 GB/s, tuned Fri Jan 29 19:23:14 2016
24x48x48x2	N4quda23TwistedCloverDslashCudaI6float4S1_S1_EE	type=interior,Dslash,comm=0001,ghost=0001,reconstruct=8,dagger	160	1	1	692	1	1	0	# 459.80 Gflop/s, 304.39 GB/s, tuned Fri Jan 29 19:23:14 2016
24x48x48x2	N4quda23TwistedCloverDslashCudaI6float4S1_S1_EE	type=interior,DslashCloverTwist,comm=0001,ghost=0001,reconstruct=8,Xpay	128	1	1	864	1	1	0	# 474.06 Gflop/s, 287.31 GB/s, tuned Fri Jan 29 19:23:14 2016
24x48x48x2	N4quda23TwistedCloverDslashCudaI6float4S1_S1_EE	type=interior,DslashCloverTwist,comm=0001,ghost=0001,reconstruct=8,Xpay,dagger	64	1	1	1728	1	1	0	# 470.15 Gflop/s, 284.94 GB/s, tuned Fri Jan 29 19:23:14 2016
24x48x48x2	N4quda23TwistedCloverDslashCudaI7double2S1_S1_EE	type=exterior_t,Dslash,comm=0001,reconstruct=8	32	1	1	3456	1	1	0	# 14.79 Gflop/s, 33.37 GB/s, tuned Fri Jan 29 19:23:09 2016
24x48x48x2	N4quda23TwistedCloverDslashCudaI7double2S1_S1_EE	type=exterior_t,Dslash,comm=0001,reconstruct=8,dagger	64	1	1	1728	1	1	0	# 14.80 Gflop/s, 33.39 GB/s, tuned Fri Jan 29 19:23:04 2016
24x48x48x2	N4quda23TwistedCloverDslashCudaI7double2S1_S1_EE	type=exterior_t,DslashCloverTwist,comm=0001,reconstruct=8,Xpay	128	1	1	864	1	1	7022	# 24.08 Gflop/s, 64.20 GB/s, tuned Fri Jan 29 19:23:09 2016
24x48x48x2	N4quda23TwistedCloverDslashCudaI7double2S1_S1_EE	type=exterior_t,DslashCloverTwist,comm=0001,reconstruct=8,Xpay,dagger	128	1	1	864	1	1	6145	# 24.17 Gflop/s, 64.47 GB/s, tuned Fri Jan 29 19:23:05 2016
24x48x48x2	N4quda23TwistedCloverDslashCudaI7double2S1_S1_EE	type=interior,Dslash,comm=0001,ghost=0001,reconstruct=8	64	1	1	1728	1	1	0	# 167.78 Gflop/s, 222.15 GB/s, tuned Fri Jan 29 19:23:09 2016
24x48x48x2	N4quda23TwistedCloverDslashCudaI7double2S1_S1_EE	type=interior,Dslash,comm=0001,ghost=0001,reconstruct=8,dagger	96	1	1	1152	1	1	0	# 201.63 Gflop/s, 266.96 GB/s, tuned Fri Jan 29 19:23:04 2016
24x48x48x2	N4quda23TwistedCloverDslashCudaI7double2S1_S1_EE	type=interior,DslashCloverTwist,comm=0001,ghost=0001,reconstruct=8,Xpay	64	1	1	1728	1	1	0	# 166.87 Gflop/s, 202.26 GB/s, tuned Fri Jan 29 19:23:09 2016
24x48x48x2	N4quda23TwistedCloverDslashCudaI7double2S1_S1_EE	type=interior,DslashCloverTwist,comm=0001,ghost=0001,reconstruct=8,Xpay,dagger	32	1	1	3456	1	1	0	# 152.41 Gflop/s, 184.74 GB/s, tuned Fri Jan 29 19:23:04 2016
24x48x48x2	N4quda25xpyHeavyQuarkResidualNormI7double37double2S2_EE	vol=110592,stride=110592,precision=8,TwistFlavour=-1	1024	1	1	12	1	1	24576	# 34.59 Gflop/s, 166.02 GB/s, tuned Fri Jan 29 19:23:20 2016
24x48x48x2	N4quda3DotId6float26float4EE	vol=110592,stride=110592,precision=4,TwistFlavour=-1	896	1	1	27	1	1	7168	# 37.86 Gflop/s, 151.45 GB/s, tuned Fri Jan 29 19:23:16 2016
24x48x48x2	N4quda3xpyI7double2S1_EE	vol=110592,stride=110592,precision=8,TwistFlavour=-1	768	1	1	28	1	1	0	# 7.31 Gflop/s, 175.43 GB/s, tuned Fri Jan 29 19:23:24 2016
24x48x48x2	N4quda4axpyI6float26float4EE	vol=110592,stride=110592,precision=4,TwistFlavour=-1	832	1	1	27	1	1	0	# 28.99 Gflop/s, 173.94 GB/s, tuned Fri Jan 29 19:23:25 2016
24x48x48x2	N4quda4axpyI7double2S1_EE	vol=110592,stride=110592,precision=4,TwistFlavour=-1,vol=110592,stride=110592,precision=8,TwistFlavour=-1	1024	1	1	12	1	1	0	# 17.30 Gflop/s, 103.80 GB/s, tuned Fri Jan 29 19:23:22 2016
24x48x48x2	N4quda4xpayI6float26float4EE	vol=110592,stride=110592,precision=4,TwistFlavour=-1	800	1	1	28	1	1	0	# 29.03 Gflop/s, 174.16 GB/s, tuned Fri Jan 29 19:23:26 2016
24x48x48x2	N4quda5Norm2Id7double2S1_EE	vol=110592,stride=110592,precision=8,TwistFlavour=-1	864	1	1	28	1	1	6912	# 37.03 Gflop/s, 148.11 GB/s, tuned Fri Jan 29 19:23:09 2016
24x48x48x2	N4quda8axpyZpbxI7double2S1_EE	vol=110592,stride=110592,precision=4,TwistFlavour=-1,vol=110592,stride=110592,precision=8,TwistFlavour=-1	512	1	1	8	1	1	0	# 46.84 Gflop/s, 117.11 GB/s, tuned Fri Jan 29 19:23:18 2016
24x48x48x2	N4quda8xmyNorm2Id7double2S1_EE	vol=110592,stride=110592,precision=8,TwistFlavour=-1	832	1	1	28	1	1	6656	# 20.79 Gflop/s, 166.28 GB/s, tuned Fri Jan 29 19:23:12 2016
24x48x48x2	copyKernel	dst=vol=110592,stride=110592,precision=4,TwistFlavour=-1,src=vol=110592,stride=110592,precision=8,TwistFlavour=-1	1024	1	1	12	1	1	0	# 0.00 Gflop/s, 170.70 GB/s, tuned Fri Jan 29 19:23:12 2016
24x48x48x2	copyKernel	dst=vol=110592,stride=110592,precision=8,TwistFlavour=-1,src=vol=110592,stride=110592,precision=4,TwistFlavour=-1	992	1	1	28	1	1	0	# 0.00 Gflop/s, 163.42 GB/s, tuned Fri Jan 29 19:23:19 2016
24x48x48x4	N4quda10CovDevCudaId7double2EE	type=exterior_t,comm=0000,reconstruct=8	184	1	1	301	1	1	6145	# 4.91 Gflop/s, 6.00 GB/s, tuned Thu Dec 17 00:26:20 2015
24x48x48x4	N4quda10CovDevCudaId7double2EE	type=exterior_t,comm=0000,reconstruct=8,dagger	466	1	1	119	1	1	9831	# 4.89 Gflop/s, 5.98 GB/s, tuned Thu Dec 17 00:26:34 2015
24x48x48x4	N4quda10CovDevCudaId7double2EE	type=interior,comm=0000,ghost=0000,reconstruct=8	448	1	1	494	1	1	7022	# 53.07 Gflop/s, 754.73 GB/s, tuned Thu Dec 17 00:26:05 2015
24x48x48x4	N4quda10CovDevCudaId7double2EE	type=interior,comm=0000,ghost=0000,reconstruct=8,dagger	64	1	1	3456	1	1	0	# 52.33 Gflop/s, 744.22 GB/s, tuned Thu Dec 17 00:26:06 2015
24x48x48x4	N4quda10Gamma5CudaI7double2EE	type=default	288	1	1	768	1	1	9831	# 5.20 Gflop/s, 208.13 GB/s, tuned Thu Dec 17 00:26:03 2015
24x48x48x4	N4quda11axpyCGNorm2I7double26float26float4EE	vol=221184,stride=221184,precision=4,TwistFlavour=-1	1024	1	1	28	1	1	16384	# 80.60 Gflop/s, 161.21 GB/s, tuned Thu Dec 17 00:25:27 2015
24x48x48x4	N4quda12ContractCudaI7double2S1_EE	type=gamma5	96	1	1	2304	1	1	24576	# 13.55 Gflop/s, 54.21 GB/s, tuned Thu Dec 17 00:26:03 2015
24x48x48x4	N4quda12ContractCudaI7double2S1_EE	type=gamma5-minus	96	1	1	2304	1	1	24576	# 7.83 Gflop/s, 31.31 GB/s, tuned Thu Dec 17 00:26:07 2015
24x48x48x4	N4quda12ContractCudaI7double2S1_EE	type=gamma5-plus	96	1	1	2304	1	1	24576	# 7.88 Gflop/s, 31.53 GB/s, tuned Thu Dec 17 00:26:06 2015
24x48x48x4	N4quda16WilsonDslashCudaI7double2S1_EE	type=exterior_t,comm=0001,reconstruct=8,Xpay	96	1	1	2304	1	1	0	# 43.98 Gflop/s, 117.28 GB/s, tuned Thu Dec 17 00:25:02 2015
24x48x48x4	N4quda16WilsonDslashCudaI7double2S1_EE	type=interior,comm=0001,ghost=0001,reconstruct=8,Xpay	96	1	1	2304	1	1	0	# 136.60 Gflop/s, 191.62 GB/s, tuned Thu Dec 17 00:25:02 2015
24x48x48x4	N4quda20AsymCloverDslashCudaI7double2S1_S1_EE	type=exterior_t,comm=0001,reconstruct=8,Xpay	64	1	1	3456	1	1	0	# 57.69 Gflop/s, 153.84 GB/s, tuned Thu Dec 17 00:26:03 2015
24x48x48x4	N4quda20AsymCloverDslashCudaI7double2S1_S1_EE	type=interior,comm=0001,ghost=0001,reconstruct=8,Xpay	128	1	1	1728	1	1	16385	# 80.26 Gflop/s, 106.65 GB/s, tuned Thu Dec 17 00:26:03 2015
24x48x48x4	N4quda21TwistCloverGamma5CudaI7double2S1_EE	vol=221184,stride=221184,precision=8,TwistFlavour=-1,inverse	384	1	1	576	1	1	16385	# 2.62 Gflop/s, 52.39 GB/s, tuned Thu Dec 17 00:25:01 2015
24x48x48x4	N4quda22HeavyQuarkResidualNormI7double37double2S2_EE	vol=221184,stride=221184,precision=8,TwistFlavour=-1	1024	1	1	12	1	1	24576	# 42.25 Gflop/s, 169.01 GB/s, tuned Thu Dec 17 00:25:21 2015
24x48x48x4	N4quda23TwistedCloverDslashCudaI6float4S1_S1_EE	type=exterior_t,Dslash,comm=0001,reconstruct=8	320	1	1	692	1	1	7022	# 30.12 Gflop/s, 33.98 GB/s, tuned Thu Dec 17 00:25:22 2015
24x48x48x4	N4quda23TwistedCloverDslashCudaI6float4S1_S1_EE	type=exterior_t,Dslash,comm=0001,reconstruct=8,dagger	640	1	1	346	1	1	9831	# 30.09 Gflop/s, 33.95 GB/s, tuned Thu Dec 17 00:25:22 2015
24x48x48x4	N4quda23TwistedCloverDslashCudaI6float4S1_S1_EE	type=exterior_t,DslashCloverTwist,comm=0001,reconstruct=8,Xpay	160	1	1	1383	1	1	0	# 51.33 Gflop/s, 68.45 GB/s, tuned Thu Dec 17 00:25:22 2015
24x48x48x4	N4quda23TwistedCloverDslashCudaI6float4S1_S1_EE	type=exterior_t,DslashCloverTwist,comm=0001,reconstruct=8,Xpay,dagger	608	1	1	364	1	1	8193	# 51.40 Gflop/s, 68.54 GB/s, tuned Thu Dec 17 00:25:23 2015
24x48x48x4	N4quda23TwistedCloverDslashCudaI6float4S1_S1_EE	type=interior,Dslash,comm=0001,ghost=0001,reconstruct=8	64	1	1	3456	1	1	0	# 321.86 Gflop/s, 219.60 GB/s, tuned Thu Dec 17 00:25:21 2015
24x48x48x4	N4quda23TwistedCloverDslashCudaI6float4S1_S1_EE	type=interior,Dslash,comm=0001,ghost=0001,reconstruct=8,dagger	128	1	1	1728	1	1	0	# 322.22 Gflop/s, 219.84 GB/s, tuned Thu Dec 17 00:25:22 2015
24x48x48x4	N4quda23TwistedCloverDslashCudaI6float4S1_S1_EE	type=interior,DslashCloverTwist,comm=0001,ghost=0001,reconstruct=8,Xpay	320	1	1	692	1	1	16385	# 366.15 Gflop/s, 236.85 GB/s, tuned Thu Dec 17 00:25:22 2015
24x48x48x4	N4quda23TwistedCloverDslashCudaI6float4S1_S1_EE	type=interior,DslashCloverTwist,comm=0001,ghost=0001,reconstruct=8,Xpay,dagger	640	1	1	346	1	1	24577	# 367.33 Gflop/s, 237.61 GB/s, tuned Thu Dec 17 00:25:23 2015
24x48x48x4	N4quda23TwistedCloverDslashCudaI7double2S1_S1_EE	type=exterior_t,Dslash,comm=0001,reconstruct=8	128	1	1	1728	1	1	7022	# 14.66 Gflop/s, 33.08 GB/s, tuned Thu Dec 17 00:25:12 2015
24x48x48x4	N4quda23TwistedCloverDslashCudaI7double2S1_S1_EE	type=exterior_t,Dslash,comm=0001,reconstruct=8,dagger	64	1	1	3456	1	1	0	# 14.67 Gflop/s, 33.11 GB/s, tuned Thu Dec 17 00:25:03 2015
24x48x48x4	N4quda23TwistedCloverDslashCudaI7double2S1_S1_EE	type=exterior_t,DslashCloverTwist,comm=0001,reconstruct=8,Xpay	64	1	1	3456	1	1	0	# 23.87 Gflop/s, 63.66 GB/s, tuned Thu Dec 17 00:25:13 2015
24x48x48x4	N4quda23TwistedCloverDslashCudaI7double2S1_S1_EE	type=exterior_t,DslashCloverTwist,comm=0001,reconstruct=8,Xpay,dagger	128	1	1	1728	1	1	0	# 23.85 Gflop/s, 63.59 GB/s, tuned Thu Dec 17 00:25:03 2015
24x48x48x4	N4quda23TwistedCloverDslashCudaI7double2S1_S1_EE	type=interior,Dslash,comm=0001,ghost=0001,reconstruct=8	64	1	1	3456	1	1	0	# 92.70 Gflop/s, 126.50 GB/s, tuned Thu Dec 17 00:25:12 2015
24x48x48x4	N4quda23TwistedCloverDslashCudaI7double2S1_S1_EE	type=interior,Dslash,comm=0001,ghost=0001,reconstruct=8,dagger	192	1	1	1152	1	1	6145	# 112.69 Gflop/s, 153.77 GB/s, tuned Thu Dec 17 00:25:02 2015
24x48x48x4	N4quda23TwistedCloverDslashCudaI7double2S1_S1_EE	type=interior,DslashCloverTwist,comm=0001,ghost=0001,reconstruct=8,Xpay	64	1	1	3456	1	1	0	# 99.61 Gflop/s, 128.87 GB/s, tuned Thu Dec 17 00:25:13 2015
24x48x48x4	N4quda23TwistedCloverDslashCudaI7double2S1_S1_EE	type=interior,DslashCloverTwist,comm=0001,ghost=0001,reconstruct=8,Xpay,dagger	32	1	1	6912	1	1	0	# 103.30 Gflop/s, 133.64 GB/s, tuned Thu Dec 17 00:25:03 2015
24x48x48x4	N4quda25xpyHeavyQuarkResidualNormI7double37double2S2_EE	vol=221184,stride=221184,precision=8,TwistFlavour=-1	1024	1	1	12	1	1	24576	# 35.90 Gflop/s, 172.34 GB/s, tuned Thu Dec 17 00:25:34 2015
24x48x48x4	N4quda3DotId6float26float4EE	vol=221184,stride=221184,precision=4,TwistFlavour=-1	928	1	1	28	1	1	7424	# 41.49 Gflop/s, 165.94 GB/s, tuned Thu Dec 17 00:25:25 2015
24x48x48x4	N4quda3xpyI7double2S1_EE	vol=221184,stride=221184,precision=8,TwistFlavour=-1	768	1	1	28	1	1	0	# 7.33 Gflop/s, 175.91 GB/s, tuned Thu Dec 17 00:25:41 2015
24x48x48x4	N4quda4axpyI6float26float4EE	vol=221184,stride=221184,precision=4,TwistFlavour=-1	832	1	1	28	1	1	0	# 29.38 Gflop/s, 176.26 GB/s, tuned Thu Dec 17 00:25:43 2015
24x48x48x4	N4quda4axpyI7double2S1_EE	vol=221184,stride=221184,precision=4,TwistFlavour=-1,vol=221184,stride=221184,precision=8,TwistFlavour=-1	896	1	1	10	1	1	0	# 17.18 Gflop/s, 103.05 GB/s, tuned Thu Dec 17 00:25:37 2015
24x48x48x4	N4quda4xpayI6float26float4EE	vol=221184,stride=221184,precision=4,TwistFlavour=-1	768	1	1	28	1	1	0	# 29.50 Gflop/s, 177.03 GB/s, tuned Thu Dec 17 00:25:44 2015
24x48x48x4	N4quda5Norm2Id7double2S1_EE	vol=221184,stride=221184,precision=8,TwistFlavour=-1	928	1	1	28	1	1	7424	# 40.33 Gflop/s, 161.32 GB/s, tuned Thu Dec 17 00:25:12 2015
24x48x48x4	N4quda8axpyZpbxI7double2S1_EE	vol=221184,stride=221184,precision=4,TwistFlavour=-1,vol=221184,stride=221184,precision=8,TwistFlavour=-1	256	1	1	11	1	1	0	# 46.84 Gflop/s, 117.10 GB/s, tuned Thu Dec 17 00:25:29 2015
24x48x48x4	N4quda8xmyNorm2Id7double2S1_EE	vol=221184,stride=221184,precision=8,TwistFlavour=-1	832	1	1	28	1	1	6656	# 21.19 Gflop/s, 169.55 GB/s, tuned Thu Dec 17 00:25:17 2015
24x48x48x4	copyKernel	dst=vol=221184,stride=221184,precision=4,TwistFlavour=-1,src=vol=221184,stride=221184,precision=8,TwistFlavour=-1	1024	1	1	12	1	1	0	# 0.00 Gflop/s, 171.22 GB/s, tuned Thu Dec 17 00:25:19 2015
24x48x48x4	copyKernel	dst=vol=221184,stride=221184,precision=8,TwistFlavour=-1,src=vol=221184,stride=221184,precision=4,TwistFlavour=-1	608	1	1	28	1	1	0	# 0.00 Gflop/s, 160.27 GB/s, tuned Thu Dec 17 00:25:31 2015
24x48x48x6	N4quda10CovDevCudaId7double2EE	type=exterior_t,comm=0000,reconstruct=8	424	1	1	131	1	1	7022	# 7.32 Gflop/s, 5.97 GB/s, tuned Mon Jan  4 12:13:23 2016
24x48x48x6	N4quda10CovDevCudaId7double2EE	type=exterior_t,comm=0000,reconstruct=8,dagger	40	1	1	1383	1	1	0	# 7.33 Gflop/s, 5.97 GB/s, tuned Mon Jan  4 12:13:36 2016
24x48x48x6	N4quda10CovDevCudaId7double2EE	type=interior,comm=0000,ghost=0000,reconstruct=8	176	1	1	1886	1	1	7022	# 53.73 Gflop/s, 764.21 GB/s, tuned Mon Jan  4 12:13:06 2016
24x48x48x6	N4quda10CovDevCudaId7double2EE	type=interior,comm=0000,ghost=0000,reconstruct=8,dagger	208	1	1	1596	1	1	0	# 53.51 Gflop/s, 761.04 GB/s, tuned Mon Jan  4 12:13:08 2016
24x48x48x6	N4quda10Gamma5CudaI7double2EE	type=default	288	1	1	1152	1	1	9831	# 5.25 Gflop/s, 195.92 GB/s, tuned Mon Jan  4 12:13:04 2016
24x48x48x6	N4quda11axpyCGNorm2I7double26float26float4EE	vol=331776,stride=331776,precision=4,TwistFlavour=-1	1024	1	1	28	1	1	16384	# 82.38 Gflop/s, 164.76 GB/s, tuned Mon Jan  4 12:12:24 2016
24x48x48x6	N4quda12ContractCudaI7double2S1_EE	type=gamma5	96	1	1	3456	1	1	24576	# 13.67 Gflop/s, 51.05 GB/s, tuned Mon Jan  4 12:13:04 2016
24x48x48x6	N4quda12ContractCudaI7double2S1_EE	type=gamma5-minus	96	1	1	3456	1	1	24576	# 8.01 Gflop/s, 29.90 GB/s, tuned Mon Jan  4 12:13:09 2016
24x48x48x6	N4quda12ContractCudaI7double2S1_EE	type=gamma5-plus	96	1	1	3456	1	1	24576	# 7.97 Gflop/s, 29.76 GB/s, tuned Mon Jan  4 12:13:09 2016
24x48x48x6	N4quda16WilsonDslashCudaI7double2S1_EE	type=exterior_t,comm=0001,reconstruct=8,Xpay	96	1	1	3456	1	1	0	# 43.97 Gflop/s, 117.25 GB/s, tuned Mon Jan  4 12:11:54 2016
24x48x48x6	N4quda16WilsonDslashCudaI7double2S1_EE	type=interior,comm=0001,ghost=0001,reconstruct=8,Xpay	96	1	1	3456	1	1	0	# 137.53 Gflop/s, 197.48 GB/s, tuned Mon Jan  4 12:11:54 2016
24x48x48x6	N4quda20AsymCloverDslashCudaI7double2S1_S1_EE	type=exterior_t,comm=0001,reconstruct=8,Xpay	128	1	1	2592	1	1	0	# 56.72 Gflop/s, 151.26 GB/s, tuned Mon Jan  4 12:13:03 2016
24x48x48x6	N4quda20AsymCloverDslashCudaI7double2S1_S1_EE	type=interior,comm=0001,ghost=0001,reconstruct=8,Xpay	128	1	1	2592	1	1	0	# 76.96 Gflop/s, 104.20 GB/s, tuned Mon Jan  4 12:13:03 2016
24x48x48x6	N4quda21TwistCloverGamma5CudaI7double2S1_EE	vol=331776,stride=331776,precision=8,TwistFlavour=-1,inverse	384	1	1	864	1	1	12289	# 2.63 Gflop/s, 49.01 GB/s, tuned Mon Jan  4 12:11:54 2016
24x48x48x6	N4quda22HeavyQuarkResidualNormI7double37double2S2_EE	vol=331776,stride=331776,precision=8,TwistFlavour=-1	1024	1	1	12	1	1	24576	# 43.66 Gflop/s, 174.62 GB/s, tuned Mon Jan  4 12:12:15 2016
24x48x48x6	N4quda23TwistedCloverDslashCudaI6float4S1_S1_EE	type=exterior_t,Dslash,comm=0001,reconstruct=8	640	1	1	519	1	1	16385	# 30.34 Gflop/s, 34.23 GB/s, tuned Mon Jan  4 12:12:15 2016
24x48x48x6	N4quda23TwistedCloverDslashCudaI6float4S1_S1_EE	type=exterior_t,Dslash,comm=0001,reconstruct=8,dagger	64	1	1	5184	1	1	0	# 30.30 Gflop/s, 34.19 GB/s, tuned Mon Jan  4 12:12:16 2016
24x48x48x6	N4quda23TwistedCloverDslashCudaI6float4S1_S1_EE	type=exterior_t,DslashCloverTwist,comm=0001,reconstruct=8,Xpay	640	1	1	519	1	1	12289	# 50.87 Gflop/s, 67.83 GB/s, tuned Mon Jan  4 12:12:16 2016
24x48x48x6	N4quda23TwistedCloverDslashCudaI6float4S1_S1_EE	type=exterior_t,DslashCloverTwist,comm=0001,reconstruct=8,Xpay,dagger	576	1	1	576	1	1	8193	# 51.26 Gflop/s, 68.34 GB/s, tuned Mon Jan  4 12:12:17 2016
24x48x48x6	N4quda23TwistedCloverDslashCudaI6float4S1_S1_EE	type=interior,Dslash,comm=0001,ghost=0001,reconstruct=8	64	1	1	5184	1	1	0	# 295.17 Gflop/s, 203.27 GB/s, tuned Mon Jan  4 12:12:15 2016
24x48x48x6	N4quda23TwistedCloverDslashCudaI6float4S1_S1_EE	type=interior,Dslash,comm=0001,ghost=0001,reconstruct=8,dagger	160	1	1	2074	1	1	0	# 295.52 Gflop/s, 203.51 GB/s, tuned Mon Jan  4 12:12:16 2016
24x48x48x6	N4quda23TwistedCloverDslashCudaI6float4S1_S1_EE	type=interior,DslashCloverTwist,comm=0001,ghost=0001,reconstruct=8,Xpay	640	1	1	519	1	1	8193	# 347.32 Gflop/s, 229.05 GB/s, tuned Mon Jan  4 12:12:16 2016
24x48x48x6	N4quda23TwistedCloverDslashCudaI6float4S1_S1_EE	type=interior,DslashCloverTwist,comm=0001,ghost=0001,reconstruct=8,Xpay,dagger	640	1	1	519	1	1	16385	# 347.28 Gflop/s, 229.02 GB/s, tuned Mon Jan  4 12:12:17 2016
24x48x48x6	N4quda23TwistedCloverDslashCudaI7double2S1_S1_EE	type=exterior_t,Dslash,comm=0001,reconstruct=8	128	1	1	2592	1	1	7022	# 14.71 Gflop/s, 33.19 GB/s, tuned Mon Jan  4 12:12:02 2016
24x48x48x6	N4quda23TwistedCloverDslashCudaI7double2S1_S1_EE	type=exterior_t,Dslash,comm=0001,reconstruct=8,dagger	128	1	1	2592	1	1	0	# 14.70 Gflop/s, 33.17 GB/s, tuned Mon Jan  4 12:11:56 2016
24x48x48x6	N4quda23TwistedCloverDslashCudaI7double2S1_S1_EE	type=exterior_t,DslashCloverTwist,comm=0001,reconstruct=8,Xpay	128	1	1	2592	1	1	7022	# 23.86 Gflop/s, 63.63 GB/s, tuned Mon Jan  4 12:12:02 2016
24x48x48x6	N4quda23TwistedCloverDslashCudaI7double2S1_S1_EE	type=exterior_t,DslashCloverTwist,comm=0001,reconstruct=8,Xpay,dagger	128	1	1	2592	1	1	7022	# 23.84 Gflop/s, 63.57 GB/s, tuned Mon Jan  4 12:11:56 2016
24x48x48x6	N4quda23TwistedCloverDslashCudaI7double2S1_S1_EE	type=interior,Dslash,comm=0001,ghost=0001,reconstruct=8	128	1	1	2592	1	1	0	# 79.92 Gflop/s, 110.07 GB/s, tuned Mon Jan  4 12:12:01 2016
24x48x48x6	N4quda23TwistedCloverDslashCudaI7double2S1_S1_EE	type=interior,Dslash,comm=0001,ghost=0001,reconstruct=8,dagger	64	1	1	5184	1	1	0	# 98.13 Gflop/s, 135.15 GB/s, tuned Mon Jan  4 12:11:55 2016
24x48x48x6	N4quda23TwistedCloverDslashCudaI7double2S1_S1_EE	type=interior,DslashCloverTwist,comm=0001,ghost=0001,reconstruct=8,Xpay	32	1	1	10368	1	1	0	# 90.44 Gflop/s, 119.29 GB/s, tuned Mon Jan  4 12:12:02 2016
24x48x48x6	N4quda23TwistedCloverDslashCudaI7double2S1_S1_EE	type=interior,DslashCloverTwist,comm=0001,ghost=0001,reconstruct=8,Xpay,dagger	32	1	1	10368	1	1	0	# 88.47 Gflop/s, 116.68 GB/s, tuned Mon Jan  4 12:11:56 2016
24x48x48x6	N4quda25xpyHeavyQuarkResidualNormI7double37double2S2_EE	vol=331776,stride=331776,precision=8,TwistFlavour=-1	1024	1	1	12	1	1	24576	# 36.72 Gflop/s, 176.25 GB/s, tuned Mon Jan  4 12:12:34 2016
24x48x48x6	N4quda3DotId6float26float4EE	vol=331776,stride=331776,precision=4,TwistFlavour=-1	960	1	1	28	1	1	7680	# 42.56 Gflop/s, 170.23 GB/s, tuned Mon Jan  4 12:12:20 2016
24x48x48x6	N4quda3xpyI7double2S1_EE	vol=331776,stride=331776,precision=8,TwistFlavour=-1	768	1	1	28	1	1	0	# 7.28 Gflop/s, 174.67 GB/s, tuned Mon Jan  4 12:12:43 2016
24x48x48x6	N4quda4axpyI6float26float4EE	vol=331776,stride=331776,precision=4,TwistFlavour=-1	800	1	1	28	1	1	0	# 29.45 Gflop/s, 176.72 GB/s, tuned Mon Jan  4 12:12:46 2016
24x48x48x6	N4quda4axpyI7double2S1_EE	vol=331776,stride=331776,precision=4,TwistFlavour=-1,vol=331776,stride=331776,precision=8,TwistFlavour=-1	1024	1	1	10	1	1	0	# 17.22 Gflop/s, 103.34 GB/s, tuned Mon Jan  4 12:12:38 2016
24x48x48x6	N4quda4xpayI6float26float4EE	vol=331776,stride=331776,precision=4,TwistFlavour=-1	736	1	1	28	1	1	0	# 29.34 Gflop/s, 176.03 GB/s, tuned Mon Jan  4 12:12:49 2016
24x48x48x6	N4quda5Norm2Id7double2S1_EE	vol=331776,stride=331776,precision=8,TwistFlavour=-1	928	1	1	28	1	1	7424	# 41.60 Gflop/s, 166.40 GB/s, tuned Mon Jan  4 12:12:01 2016
24x48x48x6	N4quda8axpyZpbxI7double2S1_EE	vol=331776,stride=331776,precision=4,TwistFlavour=-1,vol=331776,stride=331776,precision=8,TwistFlavour=-1	512	1	1	6	1	1	0	# 47.21 Gflop/s, 118.01 GB/s, tuned Mon Jan  4 12:12:26 2016
24x48x48x6	N4quda8xmyNorm2Id7double2S1_EE	vol=331776,stride=331776,precision=8,TwistFlavour=-1	832	1	1	27	1	1	6656	# 21.25 Gflop/s, 169.98 GB/s, tuned Mon Jan  4 12:12:09 2016
24x48x48x6	copyKernel	dst=vol=331776,stride=331776,precision=4,TwistFlavour=-1,src=vol=331776,stride=331776,precision=8,TwistFlavour=-1	1024	1	1	12	1	1	0	# 0.00 Gflop/s, 171.57 GB/s, tuned Mon Jan  4 12:12:11 2016
24x48x48x6	copyKernel	dst=vol=331776,stride=331776,precision=8,TwistFlavour=-1,src=vol=331776,stride=331776,precision=4,TwistFlavour=-1	64	1	1	21	1	1	0	# 0.00 Gflop/s, 161.25 GB/s, tuned Mon Jan  4 12:12:29 2016
48x48x48x4	N4quda9GaugePlaqIdNS_11FloatNOrderIdLi18ELi2ELi8EEEEE	threads=221184,prec=8	32	2	1	6912	1	1	0	# 88.97 Gflop/s, 38.15 GB/s, tuned Thu Dec 17 00:25:00 2015
52x52x52x8	N4quda11CopyGaugeExIddLi18ENS_11FloatNOrderIdLi18ELi2ELi8EEES2_EE	out_stride=562432,in_stride=276480,geometery=4	352	1	1	629	1	1	0	# 0.00 Gflop/s, 130.75 GB/s, tuned Thu Dec 17 00:24:55 2015
52x52x52x8	N4quda14ExtractGhostExIdLi18ELi4ELi0ENS_11FloatNOrderIdLi18ELi2ELi8EEEEE	prec=8,stride=562432,extract=0,dimension=0	224	1	1	330	1	1	6145	# 0.00 Gflop/s, 55.79 GB/s, tuned Thu Dec 17 00:24:55 2015
52x52x52x8	N4quda14ExtractGhostExIdLi18ELi4ELi0ENS_11FloatNOrderIdLi18ELi2ELi8EEEEE	prec=8,stride=562432,extract=1,dimension=0	384	1	1	192	1	1	16385	# 0.00 Gflop/s, 99.26 GB/s, tuned Thu Dec 17 00:24:55 2015
52x52x52x8	N4quda14ExtractGhostExIdLi18ELi4ELi1ENS_11FloatNOrderIdLi18ELi2ELi8EEEEE	prec=8,stride=562432,extract=0,dimension=1	128	1	1	624	1	1	0	# 0.00 Gflop/s, 196.16 GB/s, tuned Thu Dec 17 00:24:55 2015
52x52x52x8	N4quda14ExtractGhostExIdLi18ELi4ELi1ENS_11FloatNOrderIdLi18ELi2ELi8EEEEE	prec=8,stride=562432,extract=1,dimension=1	128	1	1	624	1	1	0	# 0.00 Gflop/s, 177.59 GB/s, tuned Thu Dec 17 00:24:55 2015
52x52x52x8	N4quda14ExtractGhostExIdLi18ELi4ELi2ENS_11FloatNOrderIdLi18ELi2ELi8EEEEE	prec=8,stride=562432,extract=0,dimension=2	128	1	1	676	1	1	0	# 0.00 Gflop/s, 199.95 GB/s, tuned Thu Dec 17 00:24:56 2015
52x52x52x8	N4quda14ExtractGhostExIdLi18ELi4ELi2ENS_11FloatNOrderIdLi18ELi2ELi8EEEEE	prec=8,stride=562432,extract=1,dimension=2	96	1	1	902	1	1	0	# 0.00 Gflop/s, 180.36 GB/s, tuned Thu Dec 17 00:24:55 2015
52x52x52x8	N4quda14ExtractGhostExIdLi18ELi4ELi3ENS_11FloatNOrderIdLi18ELi2ELi8EEEEE	prec=8,stride=562432,extract=0,dimension=3	128	1	1	8788	1	1	0	# 0.00 Gflop/s, 213.57 GB/s, tuned Thu Dec 17 00:25:00 2015
52x52x52x8	N4quda14ExtractGhostExIdLi18ELi4ELi3ENS_11FloatNOrderIdLi18ELi2ELi8EEEEE	prec=8,stride=562432,extract=1,dimension=3	128	1	1	8788	1	1	0	# 0.00 Gflop/s, 191.01 GB/s, tuned Thu Dec 17 00:24:58 2015
8x16x16x16	N4quda10CovDevCudaId7double2EE	type=exterior_t,comm=0000,reconstruct=8	158	1	1	13	1	1	9831	# 7.76 Gflop/s, 2.37 GB/s, tuned Mon Jan  4 16:20:10 2016
8x16x16x16	N4quda10CovDevCudaId7double2EE	type=exterior_t,comm=0000,reconstruct=8,dagger	162	1	1	13	1	1	24577	# 7.75 Gflop/s, 2.37 GB/s, tuned Mon Jan  4 16:20:11 2016
8x16x16x16	N4quda10CovDevCudaId7double2EE	type=interior,comm=0000,ghost=0000,reconstruct=8	256	1	1	128	1	1	0	# 51.38 Gflop/s, 730.72 GB/s, tuned Mon Jan  4 16:20:09 2016
8x16x16x16	N4quda10CovDevCudaId7double2EE	type=interior,comm=0000,ghost=0000,reconstruct=8,dagger	128	1	1	256	1	1	0	# 51.52 Gflop/s, 732.76 GB/s, tuned Mon Jan  4 16:20:09 2016
8x16x16x16	N4quda10Gamma5CudaI7double2EE	type=default	576	1	1	57	1	1	6145	# 5.08 Gflop/s, 172.64 GB/s, tuned Mon Jan  4 16:20:08 2016
8x16x16x16	N4quda11axpyCGNorm2I7double26float26float4EE	vol=32768,stride=32768,precision=4,TwistFlavour=-1	416	1	1	26	1	1	6656	# 58.54 Gflop/s, 117.08 GB/s, tuned Mon Jan  4 16:20:05 2016
8x16x16x16	N4quda12ContractCudaI7double2S1_EE	type=gamma5	96	1	1	342	1	1	24576	# 12.80 Gflop/s, 43.52 GB/s, tuned Mon Jan  4 16:20:08 2016
8x16x16x16	N4quda12ContractCudaI7double2S1_EE	type=gamma5-minus	96	1	1	342	1	1	24576	# 7.62 Gflop/s, 25.91 GB/s, tuned Mon Jan  4 16:20:09 2016
8x16x16x16	N4quda12ContractCudaI7double2S1_EE	type=gamma5-plus	96	1	1	342	1	1	24576	# 7.69 Gflop/s, 26.15 GB/s, tuned Mon Jan  4 16:20:09 2016
8x16x16x16	N4quda16WilsonDslashCudaI7double2S1_EE	type=exterior_t,comm=0001,reconstruct=8,Xpay	64	1	1	512	1	1	0	# 26.59 Gflop/s, 70.91 GB/s, tuned Mon Jan  4 16:20:02 2016
8x16x16x16	N4quda16WilsonDslashCudaI7double2S1_EE	type=interior,comm=0001,ghost=0001,reconstruct=8,Xpay	96	1	1	342	1	1	0	# 129.26 Gflop/s, 190.65 GB/s, tuned Mon Jan  4 16:20:02 2016
8x16x16x16	N4quda20AsymCloverDslashCudaI7double2S1_S1_EE	type=exterior_t,comm=0001,reconstruct=8,Xpay	64	1	1	512	1	1	0	# 38.40 Gflop/s, 102.40 GB/s, tuned Mon Jan  4 16:20:08 2016
8x16x16x16	N4quda20AsymCloverDslashCudaI7double2S1_S1_EE	type=interior,comm=0001,ghost=0001,reconstruct=8,Xpay	256	1	1	128	1	1	9831	# 75.21 Gflop/s, 104.12 GB/s, tuned Mon Jan  4 16:20:08 2016
8x16x16x16	N4quda21TwistCloverGamma5CudaI7double2S1_EE	vol=32768,stride=32768,precision=8,TwistFlavour=-1,inverse	352	1	1	94	1	1	24577	# 2.66 Gflop/s, 45.25 GB/s, tuned Mon Jan  4 16:20:02 2016
8x16x16x16	N4quda22HeavyQuarkResidualNormI7double37double2S2_EE	vol=32768,stride=32768,precision=8,TwistFlavour=-1	320	1	1	27	1	1	7680	# 32.06 Gflop/s, 128.24 GB/s, tuned Mon Jan  4 16:20:04 2016
8x16x16x16	N4quda23TwistedCloverDslashCudaI6float4S1_S1_EE	type=exterior_t,Dslash,comm=0001,reconstruct=8	448	1	1	74	1	1	7022	# 15.82 Gflop/s, 17.85 GB/s, tuned Mon Jan  4 16:20:04 2016
8x16x16x16	N4quda23TwistedCloverDslashCudaI6float4S1_S1_EE	type=exterior_t,Dslash,comm=0001,reconstruct=8,dagger	448	1	1	74	1	1	8193	# 16.03 Gflop/s, 18.08 GB/s, tuned Mon Jan  4 16:20:04 2016
8x16x16x16	N4quda23TwistedCloverDslashCudaI6float4S1_S1_EE	type=exterior_t,DslashCloverTwist,comm=0001,reconstruct=8,Xpay	192	1	1	171	1	1	6145	# 27.63 Gflop/s, 36.84 GB/s, tuned Mon Jan  4 16:20:04 2016
8x16x16x16	N4quda23TwistedCloverDslashCudaI6float4S1_S1_EE	type=exterior_t,DslashCloverTwist,comm=0001,reconstruct=8,Xpay,dagger	192	1	1	171	1	1	0	# 27.57 Gflop/s, 36.76 GB/s, tuned Mon Jan  4 16:20:04 2016
8x16x16x16	N4quda23TwistedCloverDslashCudaI6float4S1_S1_EE	type=interior,Dslash,comm=0001,ghost=0001,reconstruct=8	128	1	1	256	1	1	0	# 253.37 Gflop/s, 176.43 GB/s, tuned Mon Jan  4 16:20:04 2016
8x16x16x16	N4quda23TwistedCloverDslashCudaI6float4S1_S1_EE	type=interior,Dslash,comm=0001,ghost=0001,reconstruct=8,dagger	128	1	1	256	1	1	0	# 254.69 Gflop/s, 177.36 GB/s, tuned Mon Jan  4 16:20:04 2016
8x16x16x16	N4quda23TwistedCloverDslashCudaI6float4S1_S1_EE	type=interior,DslashCloverTwist,comm=0001,ghost=0001,reconstruct=8,Xpay	64	1	1	512	1	1	0	# 302.08 Gflop/s, 203.78 GB/s, tuned Mon Jan  4 16:20:04 2016
8x16x16x16	N4quda23TwistedCloverDslashCudaI6float4S1_S1_EE	type=interior,DslashCloverTwist,comm=0001,ghost=0001,reconstruct=8,Xpay,dagger	320	1	1	103	1	1	16385	# 303.36 Gflop/s, 204.64 GB/s, tuned Mon Jan  4 16:20:04 2016
8x16x16x16	N4quda23TwistedCloverDslashCudaI7double2S1_S1_EE	type=exterior_t,Dslash,comm=0001,reconstruct=8	96	1	1	342	1	1	7022	# 8.89 Gflop/s, 20.05 GB/s, tuned Mon Jan  4 16:20:03 2016
8x16x16x16	N4quda23TwistedCloverDslashCudaI7double2S1_S1_EE	type=exterior_t,Dslash,comm=0001,reconstruct=8,dagger	224	1	1	147	1	1	7022	# 8.84 Gflop/s, 19.95 GB/s, tuned Mon Jan  4 16:20:02 2016
8x16x16x16	N4quda23TwistedCloverDslashCudaI7double2S1_S1_EE	type=exterior_t,DslashCloverTwist,comm=0001,reconstruct=8,Xpay	128	1	1	256	1	1	7022	# 14.40 Gflop/s, 38.41 GB/s, tuned Mon Jan  4 16:20:03 2016
8x16x16x16	N4quda23TwistedCloverDslashCudaI7double2S1_S1_EE	type=exterior_t,DslashCloverTwist,comm=0001,reconstruct=8,Xpay,dagger	96	1	1	342	1	1	7022	# 14.14 Gflop/s, 37.70 GB/s, tuned Mon Jan  4 16:20:02 2016
8x16x16x16	N4quda23TwistedCloverDslashCudaI7double2S1_S1_EE	type=interior,Dslash,comm=0001,ghost=0001,reconstruct=8	256	1	1	128	1	1	0	# 70.74 Gflop/s, 98.52 GB/s, tuned Mon Jan  4 16:20:03 2016
8x16x16x16	N4quda23TwistedCloverDslashCudaI7double2S1_S1_EE	type=interior,Dslash,comm=0001,ghost=0001,reconstruct=8,dagger	384	1	1	86	1	1	16385	# 89.36 Gflop/s, 124.45 GB/s, tuned Mon Jan  4 16:20:02 2016
8x16x16x16	N4quda23TwistedCloverDslashCudaI7double2S1_S1_EE	type=interior,DslashCloverTwist,comm=0001,ghost=0001,reconstruct=8,Xpay	256	1	1	128	1	1	12289	# 81.99 Gflop/s, 110.62 GB/s, tuned Mon Jan  4 16:20:03 2016
8x16x16x16	N4quda23TwistedCloverDslashCudaI7double2S1_S1_EE	type=interior,DslashCloverTwist,comm=0001,ghost=0001,reconstruct=8,Xpay,dagger	256	1	1	128	1	1	7022	# 81.67 Gflop/s, 110.19 GB/s, tuned Mon Jan  4 16:20:02 2016
8x16x16x16	N4quda25xpyHeavyQuarkResidualNormI7double37double2S2_EE	vol=32768,stride=32768,precision=8,TwistFlavour=-1	320	1	1	26	1	1	7680	# 29.22 Gflop/s, 140.23 GB/s, tuned Mon Jan  4 16:20:06 2016
8x16x16x16	N4quda3DotId6float26float4EE	vol=32768,stride=32768,precision=4,TwistFlavour=-1	896	1	1	28	1	1	7168	# 26.64 Gflop/s, 106.56 GB/s, tuned Mon Jan  4 16:20:05 2016
8x16x16x16	N4quda3xpyI7double2S1_EE	vol=32768,stride=32768,precision=8,TwistFlavour=-1	800	1	1	28	1	1	0	# 7.12 Gflop/s, 170.83 GB/s, tuned Mon Jan  4 16:20:07 2016
8x16x16x16	N4quda4axpyI6float26float4EE	vol=32768,stride=32768,precision=4,TwistFlavour=-1	928	1	1	25	1	1	0	# 27.15 Gflop/s, 162.87 GB/s, tuned Mon Jan  4 16:20:08 2016
8x16x16x16	N4quda4axpyI7double2S1_EE	vol=32768,stride=32768,precision=4,TwistFlavour=-1,vol=32768,stride=32768,precision=8,TwistFlavour=-1	640	1	1	28	1	1	0	# 16.81 Gflop/s, 100.86 GB/s, tuned Mon Jan  4 16:20:07 2016
8x16x16x16	N4quda4xpayI6float26float4EE	vol=32768,stride=32768,precision=4,TwistFlavour=-1	800	1	1	28	1	1	0	# 26.96 Gflop/s, 161.77 GB/s, tuned Mon Jan  4 16:20:08 2016
8x16x16x16	N4quda5Norm2Id7double2S1_EE	vol=32768,stride=32768,precision=8,TwistFlavour=-1	640	1	1	28	1	1	5120	# 26.28 Gflop/s, 105.10 GB/s, tuned Mon Jan  4 16:20:03 2016
8x16x16x16	N4quda8axpyZpbxI7double2S1_EE	vol=32768,stride=32768,precision=4,TwistFlavour=-1,vol=32768,stride=32768,precision=8,TwistFlavour=-1	416	1	1	27	1	1	0	# 47.46 Gflop/s, 118.66 GB/s, tuned Mon Jan  4 16:20:06 2016
8x16x16x16	N4quda8xmyNorm2Id7double2S1_EE	vol=32768,stride=32768,precision=8,TwistFlavour=-1	896	1	1	24	1	1	7168	# 18.49 Gflop/s, 147.91 GB/s, tuned Mon Jan  4 16:20:03 2016
8x16x16x16	copyKernel	dst=vol=32768,stride=32768,precision=4,TwistFlavour=-1,src=vol=32768,stride=32768,precision=8,TwistFlavour=-1	640	1	1	28	1	1	0	# 0.00 Gflop/s, 160.16 GB/s, tuned Mon Jan  4 16:20:04 2016
8x16x16x16	copyKernel	dst=vol=32768,stride=32768,precision=8,TwistFlavour=-1,src=vol=32768,stride=32768,precision=4,TwistFlavour=-1	768	1	1	27	1	1	0	# 0.00 Gflop/s, 167.69 GB/s, tuned Mon Jan  4 16:20:06 2016
8x16x16x32	N4quda10CovDevCudaId7double2EE	type=interior,comm=0000,ghost=0000,reconstruct=8	224	1	1	293	1	1	0	# 52.87 Gflop/s, 751.94 GB/s, tuned Mon Jan  4 15:45:14 2016
8x16x16x32	N4quda10CovDevCudaId7double2EE	type=interior,comm=0000,ghost=0000,reconstruct=8,dagger	96	1	1	683	1	1	0	# 52.66 Gflop/s, 748.98 GB/s, tuned Mon Jan  4 15:45:15 2016
8x16x16x32	N4quda10Gamma5CudaI7double2EE	type=default	416	1	1	158	1	1	9831	# 5.17 Gflop/s, 165.29 GB/s, tuned Mon Jan  4 15:45:14 2016
8x16x16x32	N4quda11axpyCGNorm2I7double26float26float4EE	vol=65536,stride=65536,precision=4,TwistFlavour=-1	448	1	1	28	1	1	7168	# 69.64 Gflop/s, 139.27 GB/s, tuned Mon Jan  4 15:45:08 2016
8x16x16x32	N4quda11axpyCGNorm2I7double26float26float4EE	vol=65536,stride=65536,precision=4,TwistFlavour=1	448	1	1	28	1	1	7168	# 69.66 Gflop/s, 139.32 GB/s, tuned Tue Jan 26 14:21:56 2016
8x16x16x32	N4quda12ContractCudaI7double2S1_EE	type=gamma5	96	1	1	683	1	1	24576	# 13.59 Gflop/s, 43.48 GB/s, tuned Mon Jan  4 15:45:14 2016
8x16x16x32	N4quda12ContractCudaI7double2S1_EE	type=gamma5-minus	96	1	1	683	1	1	24576	# 7.87 Gflop/s, 25.17 GB/s, tuned Mon Jan  4 15:45:15 2016
8x16x16x32	N4quda12ContractCudaI7double2S1_EE	type=gamma5-plus	96	1	1	683	1	1	24576	# 7.81 Gflop/s, 25.00 GB/s, tuned Mon Jan  4 15:45:15 2016
8x16x16x32	N4quda15TwistGamma5CudaI7double2EE	vol=65536,stride=65536,precision=8,TwistFlavour=-1	224	1	1	293	1	1	7022	# 10.21 Gflop/s, 163.30 GB/s, tuned Tue Jan  5 17:31:19 2016
8x16x16x32	N4quda15TwistGamma5CudaI7double2EE	vol=65536,stride=65536,precision=8,TwistFlavour=1	576	1	1	114	1	1	7022	# 10.31 Gflop/s, 164.94 GB/s, tuned Tue Jan 26 14:21:51 2016
8x16x16x32	N4quda16WilsonDslashCudaI7double2S1_EE	type=interior,comm=0000,ghost=0000,reconstruct=8,Xpay	96	1	1	683	1	1	0	# 132.74 Gflop/s, 198.73 GB/s, tuned Mon Jan  4 15:45:02 2016
8x16x16x32	N4quda17TwistedDslashCudaI6float4S1_EE	type=interior,comm=0000,ghost=0000,reconstruct=8,	64	1	1	1024	1	1	0	# 347.47 Gflop/s, 260.10 GB/s, tuned Tue Jan  5 17:31:20 2016
8x16x16x32	N4quda17TwistedDslashCudaI6float4S1_EE	type=interior,comm=0000,ghost=0000,reconstruct=8,Xpay,DslashTwist	64	1	1	1024	1	1	0	# 318.22 Gflop/s, 230.13 GB/s, tuned Tue Jan  5 17:31:20 2016
8x16x16x32	N4quda17TwistedDslashCudaI6float4S1_EE	type=interior,comm=0000,ghost=0000,reconstruct=8,Xpay,dagger,DslashTwist	128	1	1	512	1	1	0	# 318.82 Gflop/s, 230.56 GB/s, tuned Tue Jan  5 17:31:20 2016
8x16x16x32	N4quda17TwistedDslashCudaI6float4S1_EE	type=interior,comm=0000,ghost=0000,reconstruct=8,dagger,	64	1	1	1024	1	1	0	# 346.53 Gflop/s, 259.39 GB/s, tuned Tue Jan  5 17:31:20 2016
8x16x16x32	N4quda17TwistedDslashCudaI7double2S1_EE	type=interior,comm=0000,ghost=0000,reconstruct=8,	160	1	1	410	1	1	6145	# 137.16 Gflop/s, 205.34 GB/s, tuned Tue Jan  5 17:31:20 2016
8x16x16x32	N4quda17TwistedDslashCudaI7double2S1_EE	type=interior,comm=0000,ghost=0000,reconstruct=8,Xpay,DslashTwist	96	1	1	683	1	1	0	# 134.71 Gflop/s, 194.83 GB/s, tuned Tue Jan  5 17:31:20 2016
8x16x16x32	N4quda17TwistedDslashCudaI7double2S1_EE	type=interior,comm=0000,ghost=0000,reconstruct=8,Xpay,dagger,DslashTwist	160	1	1	410	1	1	6145	# 132.45 Gflop/s, 191.57 GB/s, tuned Tue Jan  5 17:31:19 2016
8x16x16x32	N4quda17TwistedDslashCudaI7double2S1_EE	type=interior,comm=0000,ghost=0000,reconstruct=8,dagger,	32	1	1	2048	1	1	0	# 141.11 Gflop/s, 211.26 GB/s, tuned Tue Jan  5 17:31:19 2016
8x16x16x32	N4quda20AsymCloverDslashCudaI7double2S1_S1_EE	type=interior,comm=0000,ghost=0000,reconstruct=8,Xpay	256	1	1	256	1	1	9831	# 76.38 Gflop/s, 107.06 GB/s, tuned Mon Jan  4 15:45:14 2016
8x16x16x32	N4quda21TwistCloverGamma5CudaI7double2S1_EE	vol=65536,stride=65536,precision=8,TwistFlavour=-1,inverse	384	1	1	171	1	1	24577	# 2.68 Gflop/s, 42.86 GB/s, tuned Mon Jan  4 15:45:02 2016
8x16x16x32	N4quda22HeavyQuarkResidualNormI7double37double2S2_EE	vol=65536,stride=65536,precision=8,TwistFlavour=-1	320	1	1	28	1	1	7680	# 37.53 Gflop/s, 150.13 GB/s, tuned Mon Jan  4 15:45:06 2016
8x16x16x32	N4quda22HeavyQuarkResidualNormI7double37double2S2_EE	vol=65536,stride=65536,precision=8,TwistFlavour=1	320	1	1	28	1	1	7680	# 37.32 Gflop/s, 149.28 GB/s, tuned Tue Jan 26 14:21:55 2016
8x16x16x32	N4quda23TwistedCloverDslashCudaI6float4S1_S1_EE	type=interior,Dslash,comm=0000,ghost=0000,reconstruct=8	128	1	1	512	1	1	0	# 254.07 Gflop/s, 178.06 GB/s, tuned Mon Jan  4 15:45:06 2016
8x16x16x32	N4quda23TwistedCloverDslashCudaI6float4S1_S1_EE	type=interior,Dslash,comm=0000,ghost=0000,reconstruct=8,dagger	128	1	1	512	1	1	0	# 253.91 Gflop/s, 177.96 GB/s, tuned Mon Jan  4 15:45:06 2016
8x16x16x32	N4quda23TwistedCloverDslashCudaI6float4S1_S1_EE	type=interior,DslashCloverTwist,comm=0000,ghost=0000,reconstruct=8,Xpay	160	1	1	410	1	1	0	# 307.95 Gflop/s, 210.43 GB/s, tuned Mon Jan  4 15:45:06 2016
8x16x16x32	N4quda23TwistedCloverDslashCudaI6float4S1_S1_EE	type=interior,DslashCloverTwist,comm=0000,ghost=0000,reconstruct=8,Xpay,dagger	128	1	1	512	1	1	0	# 307.25 Gflop/s, 209.95 GB/s, tuned Mon Jan  4 15:45:07 2016
8x16x16x32	N4quda23TwistedCloverDslashCudaI7double2S1_S1_EE	type=interior,Dslash,comm=0000,ghost=0000,reconstruct=8	64	1	1	1024	1	1	0	# 66.09 Gflop/s, 92.64 GB/s, tuned Mon Jan  4 15:45:03 2016
8x16x16x32	N4quda23TwistedCloverDslashCudaI7double2S1_S1_EE	type=interior,Dslash,comm=0000,ghost=0000,reconstruct=8,dagger	128	1	1	512	1	1	0	# 80.08 Gflop/s, 112.25 GB/s, tuned Mon Jan  4 15:45:02 2016
8x16x16x32	N4quda23TwistedCloverDslashCudaI7double2S1_S1_EE	type=interior,DslashCloverTwist,comm=0000,ghost=0000,reconstruct=8,Xpay	64	1	1	1024	1	1	0	# 77.42 Gflop/s, 105.81 GB/s, tuned Mon Jan  4 15:45:04 2016
8x16x16x32	N4quda23TwistedCloverDslashCudaI7double2S1_S1_EE	type=interior,DslashCloverTwist,comm=0000,ghost=0000,reconstruct=8,Xpay,dagger	256	1	1	256	1	1	0	# 77.18 Gflop/s, 105.48 GB/s, tuned Mon Jan  4 15:45:02 2016
8x16x16x32	N4quda25xpyHeavyQuarkResidualNormI7double37double2S2_EE	vol=65536,stride=65536,precision=8,TwistFlavour=-1	320	1	1	26	1	1	7680	# 32.77 Gflop/s, 157.31 GB/s, tuned Mon Jan  4 15:45:10 2016
8x16x16x32	N4quda25xpyHeavyQuarkResidualNormI7double37double2S2_EE	vol=65536,stride=65536,precision=8,TwistFlavour=1	320	1	1	26	1	1	7680	# 32.91 Gflop/s, 157.96 GB/s, tuned Tue Jan 26 14:21:58 2016
8x16x16x32	N4quda3DotId6float26float4EE	vol=65536,stride=65536,precision=4,TwistFlavour=-1	896	1	1	28	1	1	7168	# 33.80 Gflop/s, 135.19 GB/s, tuned Mon Jan  4 15:45:07 2016
8x16x16x32	N4quda3DotId6float26float4EE	vol=65536,stride=65536,precision=4,TwistFlavour=1	992	1	1	27	1	1	7936	# 33.74 Gflop/s, 134.94 GB/s, tuned Tue Jan 26 14:21:55 2016
8x16x16x32	N4quda3xpyI7double2S1_EE	vol=65536,stride=65536,precision=8,TwistFlavour=-1	768	1	1	28	1	1	0	# 7.25 Gflop/s, 174.01 GB/s, tuned Mon Jan  4 15:45:12 2016
8x16x16x32	N4quda3xpyI7double2S1_EE	vol=65536,stride=65536,precision=8,TwistFlavour=1	768	1	1	28	1	1	0	# 7.30 Gflop/s, 175.27 GB/s, tuned Tue Jan 26 14:22:00 2016
8x16x16x32	N4quda4axpyI6float26float4EE	vol=65536,stride=65536,precision=4,TwistFlavour=-1	768	1	1	28	1	1	0	# 28.41 Gflop/s, 170.49 GB/s, tuned Mon Jan  4 15:45:13 2016
8x16x16x32	N4quda4axpyI6float26float4EE	vol=65536,stride=65536,precision=4,TwistFlavour=1	800	1	1	28	1	1	0	# 28.32 Gflop/s, 169.93 GB/s, tuned Tue Jan 26 14:22:01 2016
8x16x16x32	N4quda4axpyI7double2S1_EE	vol=65536,stride=65536,precision=4,TwistFlavour=-1,vol=65536,stride=65536,precision=8,TwistFlavour=-1	1024	1	1	28	1	1	0	# 17.07 Gflop/s, 102.42 GB/s, tuned Mon Jan  4 15:45:11 2016
8x16x16x32	N4quda4axpyI7double2S1_EE	vol=65536,stride=65536,precision=4,TwistFlavour=-1,vol=65536,stride=65536,precision=8,TwistFlavour=1	864	1	1	26	1	1	0	# 17.05 Gflop/s, 102.31 GB/s, tuned Tue Jan 26 14:22:06 2016
8x16x16x32	N4quda4axpyI7double2S1_EE	vol=65536,stride=65536,precision=4,TwistFlavour=1,vol=65536,stride=65536,precision=8,TwistFlavour=1	384	1	1	27	1	1	0	# 17.11 Gflop/s, 102.63 GB/s, tuned Tue Jan 26 14:21:59 2016
8x16x16x32	N4quda4xpayI6float26float4EE	vol=65536,stride=65536,precision=4,TwistFlavour=-1	832	1	1	28	1	1	0	# 28.39 Gflop/s, 170.32 GB/s, tuned Mon Jan  4 15:45:13 2016
8x16x16x32	N4quda4xpayI6float26float4EE	vol=65536,stride=65536,precision=4,TwistFlavour=1	832	1	1	28	1	1	0	# 28.46 Gflop/s, 170.75 GB/s, tuned Tue Jan 26 14:22:01 2016
8x16x16x32	N4quda5Norm2Id7double2S1_EE	vol=65536,stride=65536,precision=8,TwistFlavour=-1	640	1	1	28	1	1	5120	# 33.03 Gflop/s, 132.13 GB/s, tuned Mon Jan  4 15:45:03 2016
8x16x16x32	N4quda5Norm2Id7double2S1_EE	vol=65536,stride=65536,precision=8,TwistFlavour=1	896	1	1	27	1	1	7168	# 33.01 Gflop/s, 132.03 GB/s, tuned Tue Jan 26 14:21:52 2016
8x16x16x32	N4quda8axpyZpbxI7double2S1_EE	vol=65536,stride=65536,precision=4,TwistFlavour=-1,vol=65536,stride=65536,precision=8,TwistFlavour=-1	512	1	1	8	1	1	0	# 47.31 Gflop/s, 118.27 GB/s, tuned Mon Jan  4 15:45:09 2016
8x16x16x32	N4quda8axpyZpbxI7double2S1_EE	vol=65536,stride=65536,precision=4,TwistFlavour=-1,vol=65536,stride=65536,precision=8,TwistFlavour=1	512	1	1	8	1	1	0	# 47.42 Gflop/s, 118.55 GB/s, tuned Tue Jan 26 14:22:05 2016
8x16x16x32	N4quda8axpyZpbxI7double2S1_EE	vol=65536,stride=65536,precision=4,TwistFlavour=1,vol=65536,stride=65536,precision=8,TwistFlavour=1	512	1	1	8	1	1	0	# 47.66 Gflop/s, 119.16 GB/s, tuned Tue Jan 26 14:21:57 2016
8x16x16x32	N4quda8xmyNorm2Id7double2S1_EE	vol=65536,stride=65536,precision=8,TwistFlavour=-1	768	1	1	28	1	1	6144	# 20.10 Gflop/s, 160.77 GB/s, tuned Mon Jan  4 15:45:05 2016
8x16x16x32	N4quda8xmyNorm2Id7double2S1_EE	vol=65536,stride=65536,precision=8,TwistFlavour=1	864	1	1	28	1	1	6912	# 20.12 Gflop/s, 160.99 GB/s, tuned Tue Jan 26 14:21:53 2016
8x16x16x32	copyKernel	dst=vol=65536,stride=65536,precision=4,TwistFlavour=-1,src=vol=65536,stride=65536,precision=8,TwistFlavour=-1	640	1	1	26	1	1	0	# 0.00 Gflop/s, 167.83 GB/s, tuned Mon Jan  4 15:45:05 2016
8x16x16x32	copyKernel	dst=vol=65536,stride=65536,precision=4,TwistFlavour=1,src=vol=65536,stride=65536,precision=8,TwistFlavour=1	864	1	1	24	1	1	0	# 0.00 Gflop/s, 167.33 GB/s, tuned Tue Jan 26 14:21:54 2016
8x16x16x32	copyKernel	dst=vol=65536,stride=65536,precision=8,TwistFlavour=-1,src=vol=65536,stride=65536,precision=4,TwistFlavour=-1	608	1	1	27	1	1	0	# 0.00 Gflop/s, 163.96 GB/s, tuned Mon Jan  4 15:45:09 2016
8x16x16x32	copyKernel	dst=vol=65536,stride=65536,precision=8,TwistFlavour=1,src=vol=65536,stride=65536,precision=4,TwistFlavour=1	928	1	1	28	1	1	0	# 0.00 Gflop/s, 165.60 GB/s, tuned Tue Jan 26 14:21:57 2016
8x16x16x8	N4quda10CovDevCudaId7double2EE	type=exterior_t,comm=0000,reconstruct=8	226	1	1	10	1	1	8193	# 3.94 Gflop/s, 2.41 GB/s, tuned Wed Dec 16 16:39:47 2015
8x16x16x8	N4quda10CovDevCudaId7double2EE	type=exterior_t,comm=0000,reconstruct=8,dagger	444	1	1	5	1	1	9831	# 3.93 Gflop/s, 2.40 GB/s, tuned Wed Dec 16 16:39:48 2015
8x16x16x8	N4quda10CovDevCudaId7double2EE	type=interior,comm=0000,ghost=0000,reconstruct=8	64	1	1	256	1	1	0	# 47.26 Gflop/s, 672.16 GB/s, tuned Wed Dec 16 16:39:45 2015
8x16x16x8	N4quda10CovDevCudaId7double2EE	type=interior,comm=0000,ghost=0000,reconstruct=8,dagger	128	1	1	128	1	1	0	# 46.22 Gflop/s, 657.41 GB/s, tuned Wed Dec 16 16:39:45 2015
8x16x16x8	N4quda10Gamma5CudaI7double2EE	type=default	192	1	1	86	1	1	7022	# 4.85 Gflop/s, 174.71 GB/s, tuned Wed Dec 16 16:39:45 2015
8x16x16x8	N4quda11axpyCGNorm2I7double26float26float4EE	vol=16384,stride=16384,precision=4,TwistFlavour=-1	416	1	1	28	1	1	6656	# 44.52 Gflop/s, 89.04 GB/s, tuned Wed Dec 16 16:39:43 2015
8x16x16x8	N4quda12ContractCudaI7double2S1_EE	type=gamma5	96	1	1	171	1	1	24576	# 11.99 Gflop/s, 43.16 GB/s, tuned Wed Dec 16 16:39:45 2015
8x16x16x8	N4quda12ContractCudaI7double2S1_EE	type=gamma5-minus	96	1	1	171	1	1	24576	# 7.32 Gflop/s, 26.36 GB/s, tuned Wed Dec 16 16:39:45 2015
8x16x16x8	N4quda12ContractCudaI7double2S1_EE	type=gamma5-plus	96	1	1	171	1	1	24576	# 7.35 Gflop/s, 26.45 GB/s, tuned Wed Dec 16 16:39:45 2015
8x16x16x8	N4quda15TwistGamma5CudaI7double2EE	vol=16384,stride=16384,precision=8,TwistFlavour=-1	384	1	1	43	1	1	0	# 9.51 Gflop/s, 171.20 GB/s, tuned Wed Dec 16 16:39:41 2015
8x16x16x8	N4quda16WilsonDslashCudaI7double2S1_EE	type=exterior_t,comm=0001,reconstruct=8,Xpay	64	1	1	256	1	1	0	# 26.98 Gflop/s, 71.93 GB/s, tuned Wed Dec 16 16:39:41 2015
8x16x16x8	N4quda16WilsonDslashCudaI7double2S1_EE	type=interior,comm=0001,ghost=0001,reconstruct=8,Xpay	160	1	1	103	1	1	7022	# 106.09 Gflop/s, 154.02 GB/s, tuned Wed Dec 16 16:39:41 2015
8x16x16x8	N4quda17TwistedDslashCudaI6float4S1_EE	type=exterior_t,comm=0001,reconstruct=8,	160	1	1	103	1	1	0	# 40.02 Gflop/s, 45.15 GB/s, tuned Wed Dec 16 16:39:42 2015
8x16x16x8	N4quda17TwistedDslashCudaI6float4S1_EE	type=exterior_t,comm=0001,reconstruct=8,Xpay,DslashTwist	160	1	1	103	1	1	0	# 50.22 Gflop/s, 66.95 GB/s, tuned Wed Dec 16 16:39:43 2015
8x16x16x8	N4quda17TwistedDslashCudaI6float4S1_EE	type=exterior_t,comm=0001,reconstruct=8,Xpay,dagger,DslashTwist	96	1	1	171	1	1	0	# 49.08 Gflop/s, 65.44 GB/s, tuned Wed Dec 16 16:39:43 2015
8x16x16x8	N4quda17TwistedDslashCudaI6float4S1_EE	type=exterior_t,comm=0001,reconstruct=8,dagger,	320	1	1	52	1	1	6145	# 39.00 Gflop/s, 44.00 GB/s, tuned Wed Dec 16 16:39:43 2015
8x16x16x8	N4quda17TwistedDslashCudaI6float4S1_EE	type=interior,comm=0001,ghost=0001,reconstruct=8,	64	1	1	256	1	1	0	# 256.19 Gflop/s, 188.92 GB/s, tuned Wed Dec 16 16:39:42 2015
8x16x16x8	N4quda17TwistedDslashCudaI6float4S1_EE	type=interior,comm=0001,ghost=0001,reconstruct=8,Xpay,DslashTwist	160	1	1	103	1	1	0	# 244.11 Gflop/s, 170.97 GB/s, tuned Wed Dec 16 16:39:43 2015
8x16x16x8	N4quda17TwistedDslashCudaI6float4S1_EE	type=interior,comm=0001,ghost=0001,reconstruct=8,Xpay,dagger,DslashTwist	160	1	1	103	1	1	0	# 244.02 Gflop/s, 170.91 GB/s, tuned Wed Dec 16 16:39:43 2015
8x16x16x8	N4quda17TwistedDslashCudaI6float4S1_EE	type=interior,comm=0001,ghost=0001,reconstruct=8,dagger,	160	1	1	103	1	1	0	# 259.91 Gflop/s, 191.66 GB/s, tuned Wed Dec 16 16:39:43 2015
8x16x16x8	N4quda17TwistedDslashCudaI7double2S1_EE	type=exterior_t,comm=0001,reconstruct=8,	160	1	1	103	1	1	16385	# 27.43 Gflop/s, 61.89 GB/s, tuned Wed Dec 16 16:39:42 2015
8x16x16x8	N4quda17TwistedDslashCudaI7double2S1_EE	type=exterior_t,comm=0001,reconstruct=8,Xpay,DslashTwist	64	1	1	256	1	1	0	# 28.41 Gflop/s, 75.77 GB/s, tuned Wed Dec 16 16:39:42 2015
8x16x16x8	N4quda17TwistedDslashCudaI7double2S1_EE	type=exterior_t,comm=0001,reconstruct=8,Xpay,dagger,DslashTwist	160	1	1	103	1	1	0	# 29.74 Gflop/s, 79.31 GB/s, tuned Wed Dec 16 16:39:41 2015
8x16x16x8	N4quda17TwistedDslashCudaI7double2S1_EE	type=exterior_t,comm=0001,reconstruct=8,dagger,	64	1	1	256	1	1	0	# 28.24 Gflop/s, 63.73 GB/s, tuned Wed Dec 16 16:39:41 2015
8x16x16x8	N4quda17TwistedDslashCudaI7double2S1_EE	type=interior,comm=0001,ghost=0001,reconstruct=8,	160	1	1	103	1	1	16385	# 112.55 Gflop/s, 165.98 GB/s, tuned Wed Dec 16 16:39:42 2015
8x16x16x8	N4quda17TwistedDslashCudaI7double2S1_EE	type=interior,comm=0001,ghost=0001,reconstruct=8,Xpay,DslashTwist	160	1	1	103	1	1	7022	# 109.47 Gflop/s, 153.34 GB/s, tuned Wed Dec 16 16:39:42 2015
8x16x16x8	N4quda17TwistedDslashCudaI7double2S1_EE	type=interior,comm=0001,ghost=0001,reconstruct=8,Xpay,dagger,DslashTwist	160	1	1	103	1	1	6145	# 109.92 Gflop/s, 153.97 GB/s, tuned Wed Dec 16 16:39:41 2015
8x16x16x8	N4quda17TwistedDslashCudaI7double2S1_EE	type=interior,comm=0001,ghost=0001,reconstruct=8,dagger,	160	1	1	103	1	1	6145	# 111.84 Gflop/s, 164.94 GB/s, tuned Wed Dec 16 16:39:41 2015
8x16x16x8	N4quda20AsymCloverDslashCudaI7double2S1_S1_EE	type=exterior_t,comm=0001,reconstruct=8,Xpay	128	1	1	128	1	1	0	# 39.56 Gflop/s, 105.50 GB/s, tuned Mon Jan  4 18:35:05 2016
8x16x16x8	N4quda20AsymCloverDslashCudaI7double2S1_S1_EE	type=interior,comm=0001,ghost=0001,reconstruct=8,Xpay	128	1	1	128	1	1	16385	# 76.65 Gflop/s, 104.72 GB/s, tuned Mon Jan  4 18:35:05 2016
8x16x16x8	N4quda21TwistCloverGamma5CudaI7double2S1_EE	vol=16384,stride=16384,precision=8,TwistFlavour=-1,inverse	320	1	1	52	1	1	16385	# 2.56 Gflop/s, 46.16 GB/s, tuned Mon Jan  4 18:35:03 2016
8x16x16x8	N4quda22HeavyQuarkResidualNormI7double37double2S2_EE	vol=16384,stride=16384,precision=8,TwistFlavour=-1	320	1	1	28	1	1	7680	# 24.22 Gflop/s, 96.90 GB/s, tuned Wed Dec 16 16:39:42 2015
8x16x16x8	N4quda23TwistedCloverDslashCudaI6float4S1_S1_EE	type=exterior_t,Dslash,comm=0001,reconstruct=8	352	1	1	47	1	1	7022	# 16.54 Gflop/s, 18.66 GB/s, tuned Mon Jan  4 18:35:03 2016
8x16x16x8	N4quda23TwistedCloverDslashCudaI6float4S1_S1_EE	type=exterior_t,Dslash,comm=0001,reconstruct=8,dagger	352	1	1	47	1	1	8193	# 16.41 Gflop/s, 18.51 GB/s, tuned Mon Jan  4 18:35:03 2016
8x16x16x8	N4quda23TwistedCloverDslashCudaI6float4S1_S1_EE	type=exterior_t,DslashCloverTwist,comm=0001,reconstruct=8,Xpay	224	1	1	74	1	1	0	# 28.20 Gflop/s, 37.60 GB/s, tuned Mon Jan  4 18:35:03 2016
8x16x16x8	N4quda23TwistedCloverDslashCudaI6float4S1_S1_EE	type=exterior_t,DslashCloverTwist,comm=0001,reconstruct=8,Xpay,dagger	192	1	1	86	1	1	0	# 27.57 Gflop/s, 36.76 GB/s, tuned Mon Jan  4 18:35:03 2016
8x16x16x8	N4quda23TwistedCloverDslashCudaI6float4S1_S1_EE	type=interior,Dslash,comm=0001,ghost=0001,reconstruct=8	128	1	1	128	1	1	0	# 231.10 Gflop/s, 159.87 GB/s, tuned Mon Jan  4 18:35:03 2016
8x16x16x8	N4quda23TwistedCloverDslashCudaI6float4S1_S1_EE	type=interior,Dslash,comm=0001,ghost=0001,reconstruct=8,dagger	96	1	1	171	1	1	0	# 231.21 Gflop/s, 159.94 GB/s, tuned Mon Jan  4 18:35:03 2016
8x16x16x8	N4quda23TwistedCloverDslashCudaI6float4S1_S1_EE	type=interior,DslashCloverTwist,comm=0001,ghost=0001,reconstruct=8,Xpay	96	1	1	171	1	1	0	# 267.15 Gflop/s, 177.81 GB/s, tuned Mon Jan  4 18:35:03 2016
8x16x16x8	N4quda23TwistedCloverDslashCudaI6float4S1_S1_EE	type=interior,DslashCloverTwist,comm=0001,ghost=0001,reconstruct=8,Xpay,dagger	288	1	1	57	1	1	0	# 266.85 Gflop/s, 177.62 GB/s, tuned Mon Jan  4 18:35:03 2016
8x16x16x8	N4quda23TwistedCloverDslashCudaI7double2S1_S1_EE	type=exterior_t,Dslash,comm=0001,reconstruct=8	96	1	1	171	1	1	7022	# 9.11 Gflop/s, 20.56 GB/s, tuned Mon Jan  4 18:35:03 2016
8x16x16x8	N4quda23TwistedCloverDslashCudaI7double2S1_S1_EE	type=exterior_t,Dslash,comm=0001,reconstruct=8,dagger	224	1	1	74	1	1	6145	# 8.92 Gflop/s, 20.13 GB/s, tuned Mon Jan  4 18:35:03 2016
8x16x16x8	N4quda23TwistedCloverDslashCudaI7double2S1_S1_EE	type=exterior_t,DslashCloverTwist,comm=0001,reconstruct=8,Xpay	128	1	1	128	1	1	6145	# 14.23 Gflop/s, 37.95 GB/s, tuned Mon Jan  4 18:35:03 2016
8x16x16x8	N4quda23TwistedCloverDslashCudaI7double2S1_S1_EE	type=exterior_t,DslashCloverTwist,comm=0001,reconstruct=8,Xpay,dagger	224	1	1	74	1	1	6145	# 14.03 Gflop/s, 37.42 GB/s, tuned Mon Jan  4 18:35:03 2016
8x16x16x8	N4quda23TwistedCloverDslashCudaI7double2S1_S1_EE	type=interior,Dslash,comm=0001,ghost=0001,reconstruct=8	128	1	1	128	1	1	0	# 73.72 Gflop/s, 102.00 GB/s, tuned Mon Jan  4 18:35:03 2016
8x16x16x8	N4quda23TwistedCloverDslashCudaI7double2S1_S1_EE	type=interior,Dslash,comm=0001,ghost=0001,reconstruct=8,dagger	352	1	1	47	1	1	8193	# 89.69 Gflop/s, 124.09 GB/s, tuned Mon Jan  4 18:35:03 2016
8x16x16x8	N4quda23TwistedCloverDslashCudaI7double2S1_S1_EE	type=interior,DslashCloverTwist,comm=0001,ghost=0001,reconstruct=8,Xpay	128	1	1	128	1	1	0	# 86.30 Gflop/s, 114.89 GB/s, tuned Mon Jan  4 18:35:03 2016
8x16x16x8	N4quda23TwistedCloverDslashCudaI7double2S1_S1_EE	type=interior,DslashCloverTwist,comm=0001,ghost=0001,reconstruct=8,Xpay,dagger	128	1	1	128	1	1	16385	# 85.98 Gflop/s, 114.45 GB/s, tuned Mon Jan  4 18:35:03 2016
8x16x16x8	N4quda25xpyHeavyQuarkResidualNormI7double37double2S2_EE	vol=16384,stride=16384,precision=8,TwistFlavour=-1	320	1	1	28	1	1	7680	# 24.09 Gflop/s, 115.62 GB/s, tuned Wed Dec 16 16:39:44 2015
8x16x16x8	N4quda3DotId6float26float4EE	vol=16384,stride=16384,precision=4,TwistFlavour=-1	640	1	1	24	1	1	5120	# 19.37 Gflop/s, 77.47 GB/s, tuned Wed Dec 16 16:39:43 2015
8x16x16x8	N4quda3xpyI7double2S1_EE	vol=16384,stride=16384,precision=8,TwistFlavour=-1	896	1	1	28	1	1	0	# 6.83 Gflop/s, 163.87 GB/s, tuned Wed Dec 16 16:39:44 2015
8x16x16x8	N4quda4axpyI6float26float4EE	vol=16384,stride=16384,precision=4,TwistFlavour=-1	992	1	1	27	1	1	0	# 24.57 Gflop/s, 147.41 GB/s, tuned Wed Dec 16 16:39:44 2015
8x16x16x8	N4quda4axpyI7double2S1_EE	vol=16384,stride=16384,precision=4,TwistFlavour=-1,vol=16384,stride=16384,precision=8,TwistFlavour=-1	608	1	1	28	1	1	0	# 16.30 Gflop/s, 97.83 GB/s, tuned Wed Dec 16 16:39:44 2015
8x16x16x8	N4quda4xpayI6float26float4EE	vol=16384,stride=16384,precision=4,TwistFlavour=-1	800	1	1	26	1	1	0	# 24.56 Gflop/s, 147.36 GB/s, tuned Wed Dec 16 16:39:45 2015
8x16x16x8	N4quda5Norm2Id7double2S1_EE	vol=16384,stride=16384,precision=8,TwistFlavour=-1	672	1	1	28	1	1	5376	# 19.37 Gflop/s, 77.47 GB/s, tuned Wed Dec 16 16:39:42 2015
8x16x16x8	N4quda8axpyZpbxI7double2S1_EE	vol=16384,stride=16384,precision=4,TwistFlavour=-1,vol=16384,stride=16384,precision=8,TwistFlavour=-1	256	1	1	25	1	1	0	# 47.19 Gflop/s, 117.96 GB/s, tuned Wed Dec 16 16:39:43 2015
8x16x16x8	N4quda8xmyNorm2Id7double2S1_EE	vol=16384,stride=16384,precision=8,TwistFlavour=-1	448	1	1	25	1	1	3584	# 15.80 Gflop/s, 126.39 GB/s, tuned Wed Dec 16 16:39:42 2015
8x16x16x8	copyKernel	dst=vol=16384,stride=16384,precision=4,TwistFlavour=-1,src=vol=16384,stride=16384,precision=8,TwistFlavour=-1	608	1	1	27	1	1	0	# 0.00 Gflop/s, 149.20 GB/s, tuned Wed Dec 16 16:39:42 2015
8x16x16x8	copyKernel	dst=vol=16384,stride=16384,precision=8,TwistFlavour=-1,src=vol=16384,stride=16384,precision=4,TwistFlavour=-1	640	1	1	27	1	1	0	# 0.00 Gflop/s, 168.91 GB/s, tuned Wed Dec 16 16:39:43 2015
